title,num_comments,text,id,author,created_utc,score,upvote_ratio,url,flair,disorder
God damn I wish I could be religious again.,480,"It was so nice thinking that some omnipotent diety loved me and would one day take me to his supernatural kingdom. That is what I was promised, and now I have nothing to look forward to except the mundane life of the tax payer until I die. I hate religion for setting me up for the biggest disappointment on this earth. Shit never should have been invented.",13vgmex,Mundane-Fudge-8243,1685421492.0,367,0.82,https://www.reddit.com/r/RandomThoughts/comments/13vgmex/god_damn_i_wish_i_could_be_religious_again/,,Randomthoughts
Did the written or verbal alphabet come first?,2,"Did someone start drawing lines and decide what they sounded like somehow, or did someone try to draw sounds and end up with letters? 

And how would you draw sound or make sound from lines?",13vgecb,bruhhattricks,1685420789.0,2,1.0,https://www.reddit.com/r/RandomThoughts/comments/13vgecb/did_the_written_or_verbal_alphabet_come_first/,,Randomthoughts
Am i wrong about this logic?,23,"The universe has magnificent features such as galaxies, stars, and black holes. Now imagine the universe only created animals and not humans. Animals will live there life without ever glaring to the galaxy and will never be conscious of studying themselves or earthly things and space without the interest of knowledge and beauty. 

Well somehow the universe created humans for the purposes of being studied. The universes creation of the beatiful things in  earth and in space needed to have a fan base that would study and appreciate its beauty. Humans are capable of doing what the universe wants.. the universe wants to be appreciated.. 

Ever heard the phrase, "" it would be a waist of space if no more humans exist outside of our solar system."" 

Well"" it would be a waist of beauty if no one to apreciate it, when it is created.""",13vgdbk,velascono,1685420701.0,6,0.64,https://www.reddit.com/r/RandomThoughts/comments/13vgdbk/am_i_wrong_about_this_logic/,,Randomthoughts
"The more you speak, the more people won't want to listen.",1,When you start to examine your thoughts as an observer you'll begin to distinguish between the thoughts that are genuinely true for you and the shit your just repeating from someone else without any understanding. This is what to do if you want your voice to carry weight. Make sure it carries weight with you first.,13vfvjt,DisastrousGroup3945,1685419228.0,6,1.0,https://www.reddit.com/r/RandomThoughts/comments/13vfvjt/the_more_you_speak_the_more_people_wont_want_to/,,Randomthoughts
Too much to ask?,1,Does anyone remember a stoner game where you squat down and take a few deep breaths then hit a joint while standing up then having someone push on your chest till you pass out? Or how about the choking game? Anyway I have insomnia and don't want to be on meds for it and would really like someone preferably female to put me in a sleeper hold or maybe just choke me till I pass out just looking into your pretty eyes or just get creative just as long as I get put to sleep and I get cuddles after.,13vfda6,PlatypusDependent271,1685417751.0,1,0.67,https://www.reddit.com/r/RandomThoughts/comments/13vfda6/too_much_to_ask/,,Randomthoughts
Does anyone else get sad about never having sex and then forgets about it for a while?,5,,13vf804,Imposter_Syndr0me,1685417342.0,4,0.83,https://www.reddit.com/r/RandomThoughts/comments/13vf804/does_anyone_else_get_sad_about_never_having_sex/,,Randomthoughts
"The Maya, Aztec, and Inca will rise again.",3,Seriously random thought while falling asleep.,13vf5va,icantputcoinsinit,1685417164.0,1,0.67,https://www.reddit.com/r/RandomThoughts/comments/13vf5va/the_maya_aztec_and_inca_will_rise_again/,,Randomthoughts
"I’m gonna try to watch popular movies and classics, please drop some below so I can start watching",19,,13vewxw,That_Girl30,1685416446.0,4,1.0,https://www.reddit.com/r/RandomThoughts/comments/13vewxw/im_gonna_try_to_watch_popular_movies_and_classics/,,Randomthoughts
Why does my cat run into the same door over and over again,3,,13veu7z,LEGO_GODTHYFOURTH,1685416233.0,2,1.0,https://www.reddit.com/r/RandomThoughts/comments/13veu7z/why_does_my_cat_run_into_the_same_door_over_and/,,Randomthoughts
How did they thought about making a gun,6,,13vetx7,LEGO_GODTHYFOURTH,1685416211.0,2,1.0,https://www.reddit.com/r/RandomThoughts/comments/13vetx7/how_did_they_thought_about_making_a_gun/,,Randomthoughts
Memory clip,3,"I was born in 1985. 

I remember walking into the living room when I was really young. My mom was watching a movie. She told me to leave the room.

I'll never forget the clip, this woman was running on a beach and was screaming and seemed distressed and unhinged. 

I wish I knew what she was watching. I'd love to watch it now.",13vetmp,miwin85,1685416189.0,3,1.0,https://www.reddit.com/r/RandomThoughts/comments/13vetmp/memory_clip/,,Randomthoughts
Why do nose run and feet smell?,1,,13vetjm,LEGO_GODTHYFOURTH,1685416183.0,2,1.0,https://www.reddit.com/r/RandomThoughts/comments/13vetjm/why_do_nose_run_and_feet_smell/,,Randomthoughts
Lack of human decency...,19,"What happened to people treating each other with respect and compassion? Understanding? Kindness? At the end of the day we are all stuck here, trying to figure out exactly what it means to be human. We're all deserving of these things, at least. No? 

That is all.",13vemsh,Complete_Act6010,1685415673.0,10,0.86,https://www.reddit.com/r/RandomThoughts/comments/13vemsh/lack_of_human_decency/,,Randomthoughts
"I believe in what all I have and what that may provide for me, regardless of whatever conscience may see or believe in whatever life I have lived or may live.",1,,13velx9,tuffguy1992,1685415620.0,2,1.0,https://www.reddit.com/r/RandomThoughts/comments/13velx9/i_believe_in_what_all_i_have_and_what_that_may/,,Randomthoughts
"Was anyone here, if they care to share, born on April 20, 1969?",6,You must be the nicest person in the world.,13ve6ql,YesDaddysBoy,1685414470.0,2,0.75,https://www.reddit.com/r/RandomThoughts/comments/13ve6ql/was_anyone_here_if_they_care_to_share_born_on/,,Randomthoughts
Are DNA prints technically our offsprings? Or like- something to the equivalent? I’m really high rn idk man,3,,13ve4q2,OkBrazzy,1685414324.0,1,0.67,https://www.reddit.com/r/RandomThoughts/comments/13ve4q2/are_dna_prints_technically_our_offsprings_or_like/,,Randomthoughts
A scary theory about how life started on Earth,122,"What if a God-like being just started life on this planet one day because they were bored, and then forgot about it? Kind of like somebody starting to take care of a house plant, but it ends up neglected and dead.",13ve3v0,Cbissen437,1685414258.0,59,0.77,https://www.reddit.com/r/RandomThoughts/comments/13ve3v0/a_scary_theory_about_how_life_started_on_earth/,,Randomthoughts
"In that weird position where I don’t want to eat meat, because I’m a wuss about animals being hurt, but I’m to poor to afford to eat vegan.",4,"Why are fruits and vegetables so expensive?! And why is it even more expensive to make them taste good?!?! I don’t know how seasonings work, man. I’m white and broke, the only seasoning I have is salt, and I usually just eat that straight out the shaker.",13vdmoz,Ferocious_Kittyrose,1685412940.0,1,0.6,https://www.reddit.com/r/RandomThoughts/comments/13vdmoz/in_that_weird_position_where_i_dont_want_to_eat/,,Randomthoughts
I can’t be the only person who thinks WE SHOULDN’T MINE IN THE MOON!,32,"I mean we want to mine precious metals and other minerals from the moon.  Over time mining whatever ore we find May f up the gravitational pull of the earth-moon which controls our tides and f knows what else.

Seems stupid af to me.",13vdiz7,savingtheinternet,1685412668.0,0,0.5,https://www.reddit.com/r/RandomThoughts/comments/13vdiz7/i_cant_be_the_only_person_who_thinks_we_shouldnt/,,Randomthoughts
My dreams are vivid and horrible. It started once i became sober 😵‍💫 my insecurities and trauma are coming out in these dreams.,2,,13vd6t8,islandslm,1685411776.0,2,1.0,https://www.reddit.com/r/RandomThoughts/comments/13vd6t8/my_dreams_are_vivid_and_horrible_it_started_once/,,Randomthoughts
I don't know why I even have a personal email account anymore,1,"* Zero social correspondence happens in email these days.
* It's all ads, newsletters, coupons, etc.
* I use it to authenticate into other apps.

Edit: Formating",13vcyyv,NoRedeemingValue69,1685411170.0,4,1.0,https://www.reddit.com/r/RandomThoughts/comments/13vcyyv/i_dont_know_why_i_even_have_a_personal_email/,,Randomthoughts
"We are all going to die one day, and it’s nothing we can do about it.",52,,13vcugb,Shesanaturalwoman98,1685410819.0,11,0.65,https://www.reddit.com/r/RandomThoughts/comments/13vcugb/we_are_all_going_to_die_one_day_and_its_nothing/,,Randomthoughts
"In a world constantly sharing information, a person's ability to remain genuinely surprised has become a rare and valuable gift.",1,,13vcu4k,friendly-chat-bot,1685410794.0,3,1.0,https://www.reddit.com/r/RandomThoughts/comments/13vcu4k/in_a_world_constantly_sharing_information_a/,,Randomthoughts
this peanut butter stuck to my fingers need to wash my hands soon,1,,13vcgor,alibettispaghettiIG,1685409707.0,1,0.67,https://www.reddit.com/r/RandomThoughts/comments/13vcgor/this_peanut_butter_stuck_to_my_fingers_need_to/,,Randomthoughts
What does it mean when someone points out that your knees are always dirty?,13,,13vbyb1,Icy-Meaning9187,1685408213.0,3,1.0,https://www.reddit.com/r/RandomThoughts/comments/13vbyb1/what_does_it_mean_when_someone_points_out_that/,,Randomthoughts
"I wonder why people fear death, It's not like death kill people, death is just there to accompany them to the after life, can you imagine how scary it is to wander the afterlife alone?",15,"Edit: I'm talking about the representation of death, The black cloaked person who guides people to the afterlife",13vbvlf,Vegetable-Yam8730,1685407995.0,2,0.67,https://www.reddit.com/r/RandomThoughts/comments/13vbvlf/i_wonder_why_people_fear_death_its_not_like_death/,,Randomthoughts
People are altruistic by nature but it shows only when they are satisfied with their life,12,"Basically what title says if any person is satisfied with their life ( to extent they consider to be good ) they tend to show altruistic behavior. 

But still the higher the nb of people satisfied the higher the speed of rise of standards for satisfaction",13vb2ib,Rgular_dude,1685405785.0,4,1.0,https://www.reddit.com/r/RandomThoughts/comments/13vb2ib/people_are_altruistic_by_nature_but_it_shows_only/,,Randomthoughts
Do y’all change your house clothes everyday or do you wear them a few times like cartoon characters?,2,literally just wondering because a family member is staying over and i’ve been sporting the same sweatpants for the past 3 days. They’re still clean but i’m wondering if that kid goes back home is he gonna tell his mom i’m dirty or sum lol..,13vb196,try1ng_hopefully,1685405693.0,3,0.81,https://www.reddit.com/r/RandomThoughts/comments/13vb196/do_yall_change_your_house_clothes_everyday_or_do/,,Randomthoughts
"If someone who knows nothing about birds asked you ""what is this bird"" and you answered ""a blackbird"", they would think you also know nothing about birds.",1,"And if said blackbird were female and therefore not black, they would also think you are stupid.",13vaoaj,Falknerbach,1685404730.0,4,0.83,https://www.reddit.com/r/RandomThoughts/comments/13vaoaj/if_someone_who_knows_nothing_about_birds_asked/,,Randomthoughts
"Am I the only person who experiences a ""feeling"" of water surrounding my waist after spending a long amount of time in a pool.",3,,13vajoz,the_16th_ninja,1685404386.0,3,1.0,https://www.reddit.com/r/RandomThoughts/comments/13vajoz/am_i_the_only_person_who_experiences_a_feeling_of/,,Randomthoughts
Is it just me or do old Jordans look better than new ones?,1,"I personally like I to V, maybe VI and VII as well, but anything after that is just not my type.",13v9rfb,Halsenberg19239,1685402331.0,2,1.0,https://www.reddit.com/r/RandomThoughts/comments/13v9rfb/is_it_just_me_or_do_old_jordans_look_better_than/,,Randomthoughts
Why are there so many spelling errors on Reddit?,35,"Y'all have autocorrect, and the ability to Google any word you may not know. Maybe the real question is, does no one proof read?",13v9ivl,hollyberry6676,1685401694.0,5,0.69,https://www.reddit.com/r/RandomThoughts/comments/13v9ivl/why_are_there_so_many_spelling_errors_on_reddit/,,Randomthoughts
Imagin a story about a guy who makes a disease to get revenge on humanity,3,And designs it so it gives people a slow agonizing death and then gives it to himself and tries to spread it to other people but no one’s catching it and then he realizes that he was so focused on making it give people a slow painful death that he completely forgot to make it contagious and the rest of the story is just him trying to find a cure for his own disease,13v8xxn,battleaxworier,1685400173.0,2,0.75,https://www.reddit.com/r/RandomThoughts/comments/13v8xxn/imagin_a_story_about_a_guy_who_makes_a_disease_to/,,Randomthoughts
"I never understood anti homeless architecture, like, what even is the point of calling it a "" public space "" if not everyone can be there",602,"And don't even tell me that they degrade the space, they're fucking homeless, they're the ones being degraded . Even if it was true that's disgusting to say . 
The worst thing is that if most people saw a stray dog sleeping they would probably think that it's fine and that it would be scandalous to not let it sleep in peace .
If all the money that was spent to fund anti homeless architecture was spent for infrastructures where homeless people could receive help maybe we wouldn't need as much anti - homeless architecture "" but money doesn't grow on trees "" yea I agree but despite that there's  always enough to fund the building of huge spikes under bridges and the designing of benches that are made for it to be uncomfortable/impossible to sleep on  isn't there .",13v8ih3,sorryforeverithing,1685399082.0,854,0.74,https://www.reddit.com/r/RandomThoughts/comments/13v8ih3/i_never_understood_anti_homeless_architecture/,,Randomthoughts
How can a soda have more calories than a light beer?,5,,13v7aca,No_Background_8703,1685396082.0,2,1.0,https://www.reddit.com/r/RandomThoughts/comments/13v7aca/how_can_a_soda_have_more_calories_than_a_light/,,Randomthoughts
No good deed goes unpunished,2,,13v6ucx,Leading-Bank-2590,1685395007.0,2,1.0,https://www.reddit.com/r/RandomThoughts/comments/13v6ucx/no_good_deed_goes_unpunished/,,Randomthoughts
Reading random thoughts of other people to get a good random thought...,1,...or check if my random thought was equally amusing as their random thoughts.. uhh,13v6jv1,VirtualAssociation97,1685394320.0,2,1.0,https://www.reddit.com/r/RandomThoughts/comments/13v6jv1/reading_random_thoughts_of_other_people_to_get_a/,,Randomthoughts
"Is ""mensiversary"" a real word? If not, it should become a real word.",1,"BTW, mensi is a combination of the Latin words ""mensis"" meaning month and versus meaning ""turning"".",13v5in9,chameleoncove54,1685391922.0,2,1.0,https://www.reddit.com/r/RandomThoughts/comments/13v5in9/is_mensiversary_a_real_word_if_not_it_should/,,Randomthoughts
I am more convinced by my advice when texting myself,1,That momen when you advice others but don't listen to your own.,13v5hro,CloudofSerenity,1685391866.0,5,1.0,https://www.reddit.com/r/RandomThoughts/comments/13v5hro/i_am_more_convinced_by_my_advice_when_texting/,,Randomthoughts
I feel like loneliness to be successful is promoted in the west,6,"We’re not meant to be alone…

You can enjoy solitude but what’s life without others",13v5ctg,rickidontsleep,1685391544.0,2,0.75,https://www.reddit.com/r/RandomThoughts/comments/13v5ctg/i_feel_like_loneliness_to_be_successful_is/,,Randomthoughts
"Besides meteor debris, a spacecraft may be the first time in the world's history where physical material left the planet",3,,13v587q,TheGlitchedGamer,1685391245.0,3,1.0,https://www.reddit.com/r/RandomThoughts/comments/13v587q/besides_meteor_debris_a_spacecraft_may_be_the/,,Randomthoughts
The song “simply irresistible” by Robert Palmer is actually a women’s empowerment song. I have never seen it on a list of women’s empowerment songs.,3,,13v503i,Old-Bug-2197,1685390706.0,2,1.0,https://www.reddit.com/r/RandomThoughts/comments/13v503i/the_song_simply_irresistible_by_robert_palmer_is/,,Randomthoughts
I wonder if there are any MMA fighters who intentionally have bad hygiene (eg: no deodorant/showers) for an unfair psycological advantage?,7,,13v4xo5,identi7y,1685390546.0,2,1.0,https://www.reddit.com/r/RandomThoughts/comments/13v4xo5/i_wonder_if_there_are_any_mma_fighters_who/,,Randomthoughts
Imagine being the first person:,18,"- to discover that you can’t put out a grease fire with water.

- to hear a parrot talk.",13v4tsy,DrNukenstein,1685390310.0,5,1.0,https://www.reddit.com/r/RandomThoughts/comments/13v4tsy/imagine_being_the_first_person/,,Randomthoughts
"If we can write can not as ""cannot"" why can't we write a lot as ""alot""?",5,,13v4l4i,DickComingOutUrMouth,1685389728.0,1,0.67,https://www.reddit.com/r/RandomThoughts/comments/13v4l4i/if_we_can_write_can_not_as_cannot_why_cant_we/,,Randomthoughts
What are some communities with lots of fan content and don’t have a ton of drama?,5,,13v4ho2,Cubeytheawesomest,1685389498.0,2,1.0,https://www.reddit.com/r/RandomThoughts/comments/13v4ho2/what_are_some_communities_with_lots_of_fan/,,Randomthoughts
You ever realize when you’re talking to someone that you know way more than they do?,799,"Not necessarily that you’re smarter than them, but more like your brain might have access to more information in it in general.",13v4dmb,Bootiluvr,1685389227.0,1697,0.91,https://www.reddit.com/r/RandomThoughts/comments/13v4dmb/you_ever_realize_when_youre_talking_to_someone/,,Randomthoughts
One fish two fish,3,Red fish blue fish. Too bad no one knew he hated kids and cheated on his wife (while she was dying from brain cancer). He died while he was still a hero. May we all be that fortunate.,13v47hj,Fearlesswatereater,1685388814.0,2,0.76,https://www.reddit.com/r/RandomThoughts/comments/13v47hj/one_fish_two_fish/,,Randomthoughts
Working as a grocery store cashier was probably the best thing to happen to me recently.,4,"(19m) I’ve been working there for about 2 years now, looking back, I’ve definitely improved on skill such as communication, small talk, confrontation, and more. The pay is pretty good and it’s not really too stressful. I’ve made so many friends along the way. I’m honestly thankful for that opportunity to grow :)",13v41l6,funkyknog,1685388421.0,10,1.0,https://www.reddit.com/r/RandomThoughts/comments/13v41l6/working_as_a_grocery_store_cashier_was_probably/,,Randomthoughts
The second Reddit post on my feed on mobile is an ad,1,Same thing when I use the Reddit video player thing,13v41cr,Andrew4329,1685388405.0,2,1.0,https://www.reddit.com/r/RandomThoughts/comments/13v41cr/the_second_reddit_post_on_my_feed_on_mobile_is_an/,,Randomthoughts
"If you constantly fake orgasms with your partner, you're only encouraging your partners anticlimatic techniques.",2,Keep it real and don't fake.,13v3uop,GrattiesOtherPlace,1685387957.0,4,0.76,https://www.reddit.com/r/RandomThoughts/comments/13v3uop/if_you_constantly_fake_orgasms_with_your_partner/,,Randomthoughts
"With some incredibly crazy conspiracy theories circulating the world today, i always wonder how these things get started. Even more so, i wonder about the people who let the nonsense spiral out of control.",3,"Added to that, it's dangerous how theorists are deadset certain that their crazy theories are absolutely true, then take it upon their hands to act on it... What a world we live in.",13v3t26,Meatloafxx,1685387845.0,2,1.0,https://www.reddit.com/r/RandomThoughts/comments/13v3t26/with_some_incredibly_crazy_conspiracy_theories/,,Randomthoughts
What if electricity has been magic this whole time and it just feels mundane because we figured out how to control it so easily?,57,"I mean, it can start and stop hearts, allows for intercontinental travel and communication, allows us to record the special moments in our lives and time travel back to relive them, allows us to predict the weather with a decent amount of accuracy, plus a billion other “magical” things.",13v3jbp,ForestValkyrie,1685387211.0,49,0.8,https://www.reddit.com/r/RandomThoughts/comments/13v3jbp/what_if_electricity_has_been_magic_this_whole/,,Randomthoughts
The weather channel shouldn’t run flex seal false advertising commercials.,1,,13v3bk9,prybarwindow,1685386722.0,2,1.0,https://www.reddit.com/r/RandomThoughts/comments/13v3bk9/the_weather_channel_shouldnt_run_flex_seal_false/,,Randomthoughts
Anyone's else can't physically drink warm water without getting a stomach ache?,8,,13v33b3,DickComingOutUrMouth,1685386159.0,7,0.9,https://www.reddit.com/r/RandomThoughts/comments/13v33b3/anyones_else_cant_physically_drink_warm_water/,,Randomthoughts
It must be so cool making a new best friend,9,"Imagine meeting someone completely new who you’ve never met before, and just getting along great and then going places and looking back and thinking. I remember when we first met at work, a friends house or where ever it may be. And seeing how far your friendship has grown.",13v2ons,HairyPlumbs,1685385156.0,22,1.0,https://www.reddit.com/r/RandomThoughts/comments/13v2ons/it_must_be_so_cool_making_a_new_best_friend/,,Randomthoughts
"The saying 'you can be anything you want' paired with the internet really is an illusion. Most teens and young adults don't know what they want nor know of many jobs. No one teaches them about the world, except for academics",3,,13v1tr1,learningytube,1685383185.0,3,1.0,https://www.reddit.com/r/RandomThoughts/comments/13v1tr1/the_saying_you_can_be_anything_you_want_paired/,,Randomthoughts
Swings in playground,2,"I was at a playground yesterday with my toddler and noticed that the swings were hot to the touch. I was wondering why the hell the default color of swings in a playground is black, the color that absorbs the most heat. I understand they are rubber but can't a dye be added that makes them a lighter color?",13v1s8v,flyerhell,1685383075.0,3,1.0,https://www.reddit.com/r/RandomThoughts/comments/13v1s8v/swings_in_playground/,,Randomthoughts
Weed really can be the best medicine.,27,"I woke up this morning very sore and with terrible period pains. All day i’ve been nauseous and in pain, moping around. I first took some tylenol which barely helped. So I took an edible about 10-15 minutes ago and boom I feel so so relieved. It’s always my last choice, but it’s the only thing that can give me genuine relief from regular pains I experience.",13v11zb,bigbeelzebub,1685381256.0,12,0.64,https://www.reddit.com/r/RandomThoughts/comments/13v11zb/weed_really_can_be_the_best_medicine/,,Randomthoughts
The USA is just 3 phrma companies in a military trench coat,1,,13v0o9y,originaldawn,1685380349.0,4,0.83,https://www.reddit.com/r/RandomThoughts/comments/13v0o9y/the_usa_is_just_3_phrma_companies_in_a_military/,,Randomthoughts
"If you're always racing to the next moment, what happens to the one you're in?🤔",2,,13v0h9c,Cucai31,1685379863.0,2,1.0,https://www.reddit.com/r/RandomThoughts/comments/13v0h9c/if_youre_always_racing_to_the_next_moment_what/,,Randomthoughts
I just lost the game,2,,13v09d3,Shakalams,1685379364.0,2,1.0,https://www.reddit.com/r/RandomThoughts/comments/13v09d3/i_just_lost_the_game/,,Randomthoughts
What if the reason we haven't made contact with aliens yet is because they all work remotely from home planets,2,,13v0543,No_Boysenberry3497,1685379100.0,2,1.0,https://www.reddit.com/r/RandomThoughts/comments/13v0543/what_if_the_reason_we_havent_made_contact_with/,,Randomthoughts
Anyone watch SpongeBob and wonder which hole grips the tightest?,4,,13v04ne,deadheadway,1685379073.0,1,0.6,https://www.reddit.com/r/RandomThoughts/comments/13v04ne/anyone_watch_spongebob_and_wonder_which_hole/,,Randomthoughts
Why is talking to oneself in public so frowned upon. I think and I suddenly am talking to myself.,132,,13v037w,baelorthebest,1685378982.0,284,0.94,https://www.reddit.com/r/RandomThoughts/comments/13v037w/why_is_talking_to_oneself_in_public_so_frowned/,,Randomthoughts
"Some of ya'll never ate three boxes of triple c's then went to the moon, and it shows.",7,,13v02vt,deadheadway,1685378963.0,4,1.0,https://www.reddit.com/r/RandomThoughts/comments/13v02vt/some_of_yall_never_ate_three_boxes_of_triple_cs/,,Randomthoughts
I only buy asparagus to restock my junk drawer with good rubber bands.,6,,13v025h,Drunken-dreamer87,1685378912.0,9,0.85,https://www.reddit.com/r/RandomThoughts/comments/13v025h/i_only_buy_asparagus_to_restock_my_junk_drawer/,,Randomthoughts
"If people nowadays don’t wanna make children and instead decide to adopt, how are they gonna adopt a child if humanity isn’t drawn to conceiving.",33,Just something I thought during work,13uzuq2,Anxious_Revolution55,1685378441.0,3,0.59,https://www.reddit.com/r/RandomThoughts/comments/13uzuq2/if_people_nowadays_dont_wanna_make_children_and/,,Randomthoughts
"When you think about it, snakes are just a reptile head attached to a tail.",4,,13uzm8l,Sanji338,1685377892.0,4,0.84,https://www.reddit.com/r/RandomThoughts/comments/13uzm8l/when_you_think_about_it_snakes_are_just_a_reptile/,,Randomthoughts
Church has made more damage than good in overall history,12,"If we count every life saved by religion against every life taken by religion, the result is that we have lost more than we have gained.",13uz7sl,otalatita,1685376961.0,5,0.63,https://www.reddit.com/r/RandomThoughts/comments/13uz7sl/church_has_made_more_damage_than_good_in_overall/,,Randomthoughts
