title,num_comments,text,id,author,created_utc,score,upvote_ratio,url,flair,disorder
Assholes blasting their music for everyone to hear on the buss or train are never playing classical music.,1,"Sitting in front of a dingus right now, passively listening to his music on speaker, it just struck me how you never hear people blasting classical music or movie scores when they're being inconsiderate like that.",13y9p5p,Mugwumpen,1685704240.0,1,1.0,https://www.reddit.com/r/RandomThoughts/comments/13y9p5p/assholes_blasting_their_music_for_everyone_to/,,Randomthoughts
Being nice isn't always kind,1,,13y9ov9,jackal_lynn,1685704217.0,1,1.0,https://www.reddit.com/r/RandomThoughts/comments/13y9ov9/being_nice_isnt_always_kind/,,Randomthoughts
We are officially closer to 2040 than 2006,1,"This was posted at 12:00pm UK time on June 2nd 2023, the exact midpoint of both years.",13y9hwb,23aviators,1685703618.0,2,1.0,https://www.reddit.com/r/RandomThoughts/comments/13y9hwb/we_are_officially_closer_to_2040_than_2006/,,Randomthoughts
Does animal abuse count if it’s directed toward insects?,2,,13y97fb,AverageOxygenUser,1685702655.0,1,1.0,https://www.reddit.com/r/RandomThoughts/comments/13y97fb/does_animal_abuse_count_if_its_directed_toward/,,Randomthoughts
"There's a huge market for flavored breakfast cereal. I wonder if anyone's ever tried to market lunch cereals, like ham and cheese flavor or tuna.",2,,13y8tt1,ZootOfCastleAnthrax,1685701396.0,1,1.0,https://www.reddit.com/r/RandomThoughts/comments/13y8tt1/theres_a_huge_market_for_flavored_breakfast/,,Randomthoughts
Are all ladybugs female? How do you spot a male ladybug?,3,,13y8f2v,Vegetable-Yam8730,1685700016.0,1,1.0,https://www.reddit.com/r/RandomThoughts/comments/13y8f2v/are_all_ladybugs_female_how_do_you_spot_a_male/,,Randomthoughts
Is there anybody who actually has a great life?,4,"I'm not talking about people who are happy with their life, I'm talking about people who never had a traumatic childhood, who grew up with a great family, who had all the money, who went to a great college, got the life of their dreams, etc. Is that possible?",13y7zfe,Individual_Pickle_26,1685698489.0,1,1.0,https://www.reddit.com/r/RandomThoughts/comments/13y7zfe/is_there_anybody_who_actually_has_a_great_life/,,Randomthoughts
Wouldn't it be funny if you dated someone with the same birthday as you? Lol,2,,13y7x7z,Frostwood89,1685698259.0,2,1.0,https://www.reddit.com/r/RandomThoughts/comments/13y7x7z/wouldnt_it_be_funny_if_you_dated_someone_with_the/,,Randomthoughts
Why is it that telling rape jokes is unacceptable but joking about 9/11 isn't?,6,,13y7wf7,YtSabit,1685698187.0,1,1.0,https://www.reddit.com/r/RandomThoughts/comments/13y7wf7/why_is_it_that_telling_rape_jokes_is_unacceptable/,,Randomthoughts
Why do we have to have favorites?,3,"Ask me my favorite song and it will be what I’m into at the moment which could change daily. My favorite color? I like green, but red is stimulating, yellow is calm…it depends on my mood. I can’t pick a favorite food, flavor, show, anything, really. It all depends on my mood atm. Why do we have to pick one favorite of anything?",13y7rln,Bestbishfurever,1685697696.0,1,1.0,https://www.reddit.com/r/RandomThoughts/comments/13y7rln/why_do_we_have_to_have_favorites/,,Randomthoughts
I’m hungry but I just brushed my teeth so anything I eat will taste bad.,4,,13y7hrg,AdSame7652,1685696697.0,1,1.0,https://www.reddit.com/r/RandomThoughts/comments/13y7hrg/im_hungry_but_i_just_brushed_my_teeth_so_anything/,,Randomthoughts
The sound of wind is the best sound in the world,6,,13y7ce2,david55509,1685696178.0,2,0.67,https://www.reddit.com/r/RandomThoughts/comments/13y7ce2/the_sound_of_wind_is_the_best_sound_in_the_world/,,Randomthoughts
Whatever happened to the Bagel Boss guy that went viral for throwing tantrums in public venues?,4,,13y6rcd,calmanxiety88,1685693976.0,1,1.0,https://www.reddit.com/r/RandomThoughts/comments/13y6rcd/whatever_happened_to_the_bagel_boss_guy_that_went/,,Randomthoughts
There is definitely a porno called Fifty Shades of Gay,2,,13y6r66,MacDaddy9897,1685693960.0,2,0.75,https://www.reddit.com/r/RandomThoughts/comments/13y6r66/there_is_definitely_a_porno_called_fifty_shades/,,Randomthoughts
"In my parents' generation, success was remembering information",1,"In my generation, success is knowing how to find and action information (Google and other ""static"" sources).

In the next generation, success will be knowing which questions are valuable.",13y6qlb,Site_Efficient,1685693899.0,1,1.0,https://www.reddit.com/r/RandomThoughts/comments/13y6qlb/in_my_parents_generation_success_was_remembering/,,Randomthoughts
A Dry blow job…Is that even a thing?,3,,13y695i,Dense-Substance-3102,1685692073.0,2,1.0,https://www.reddit.com/r/RandomThoughts/comments/13y695i/a_dry_blow_jobis_that_even_a_thing/,,Randomthoughts
I'm a Nightowl.,41,I sometimes feel like I am the only one who likes to be up and awake at night/nighttime. Is there anybody else who prefers to be awake at night and asleep during the day?,13y676z,Glacierhaven12,1685691860.0,25,0.93,https://www.reddit.com/r/RandomThoughts/comments/13y676z/im_a_nightowl/,,Randomthoughts
Do you ever feel like a plastic bag?,3,"Drifting through the wind, wanting to start again?",13y659i,murphyeous,1685691644.0,1,0.67,https://www.reddit.com/r/RandomThoughts/comments/13y659i/do_you_ever_feel_like_a_plastic_bag/,,Randomthoughts
Who made up that high maintenance women = high quality women?,3,,13y5zam,imatpanera,1685691008.0,1,1.0,https://www.reddit.com/r/RandomThoughts/comments/13y5zam/who_made_up_that_high_maintenance_women_high/,,Randomthoughts
It used to be a well known fact that ants would take over the earth. Now they will have to contend with AI....and humans will never know who wins.,4,,13y5q8q,g_master_b,1685690020.0,1,1.0,https://www.reddit.com/r/RandomThoughts/comments/13y5q8q/it_used_to_be_a_well_known_fact_that_ants_would/,,Randomthoughts
"It's interesting how when you translate something and you can't think of the right word, your mind seems to translate it in another language where you know the translation",1,"A few days ago I was thinking about how you would say ""Two beers please"" in Japanese. I can speak Dutch, English and a little bit Spanish, I know very little about Japanese. Beer was easy, it was something like ""Bierru"". But then the other words... my mind seemed to automatically come up with ""Dos bierru por favor"". That's no Japanese, that's goddamn Spanish.",13y57ap,Taxfraud777,1685688082.0,1,1.0,https://www.reddit.com/r/RandomThoughts/comments/13y57ap/its_interesting_how_when_you_translate_something/,,Randomthoughts
"The reason why it's ""Red vs Blue"".",1,"I thought of this for a while, but basically, i figured out why it might of always been red vs blue. If you invert red, it turns into approximately blue, and inverting blue turns into approximately red. Second possibility is because blue and red are opposite of each other on the color spectrum. The second option is more likely.",13y51wk,ClayArrobakker1998,1685687507.0,1,1.0,https://www.reddit.com/r/RandomThoughts/comments/13y51wk/the_reason_why_its_red_vs_blue/,,Randomthoughts
"If the speed of consumption in a black hole were to directly influence the rate of expansion in the universe, then humanity's ever-growing appetite for knowledge and curiosity could potentially fuel the cosmos in unimaginable ways.",1,,13y4s3m,friendly-chat-bot,1685686507.0,1,1.0,https://www.reddit.com/r/RandomThoughts/comments/13y4s3m/if_the_speed_of_consumption_in_a_black_hole_were/,,Randomthoughts
"If you could sit across from one person (dead or alive), ask one question and know you would get 100% truth. Who would it be, what would you ask and why?",16,,13y45b3,Fragrant_Brief6031,1685684251.0,3,0.81,https://www.reddit.com/r/RandomThoughts/comments/13y45b3/if_you_could_sit_across_from_one_person_dead_or/,,Randomthoughts
Anyone else dislike a person who is overly annoying but is same level kind and sweet and that's why feel guilty disliking them?,2,,13y42vr,MummaheReddit,1685684017.0,1,1.0,https://www.reddit.com/r/RandomThoughts/comments/13y42vr/anyone_else_dislike_a_person_who_is_overly/,,Randomthoughts
"When/why did trauma, physical illnesses, and mental ""disorders"" become a trend?!",5,No but really...wth!,13y40ex,D3RPR3SSI0N,1685683782.0,1,0.67,https://www.reddit.com/r/RandomThoughts/comments/13y40ex/whenwhy_did_trauma_physical_illnesses_and_mental/,,Randomthoughts
Has anyone actually got a cookie when a person asked them sarcastically if they wanted one?,1,"I know it’s usually a rhetorical question when asked in that fashion, but I like cookies so I’m curious if saying yes to that has resulted in an actual cookie

Edit: in case anyone needs a reminder A rhetorical question a question asked in order to create a dramatic effect or to make a point rather than to get an answer.",13y3ycj,2020-RedditUser,1685683576.0,1,0.99,https://www.reddit.com/r/RandomThoughts/comments/13y3ycj/has_anyone_actually_got_a_cookie_when_a_person/,,Randomthoughts
Should I or shouldn't I,4,"I've been divorced for almost 5 years with no contact. Not an ugly divorce, but it was my choice, and i moved to another state.  I'm in a great relationship now, but mutual friends say he is still bitter.  I came across some photos on my phone of him with his brother and sister in law on vacations we all took together. I printed the photos and want to send them, but am hesitating. I'm not in any of the photos.  Do I send them or not?",13y3r8q,ThatTravel5692,1685682901.0,1,1.0,https://www.reddit.com/r/RandomThoughts/comments/13y3r8q/should_i_or_shouldnt_i/,,Randomthoughts
I suspect that Puddle of Mudd just to be dicks play Puddle of Mudd songs at their shows.,1,,13y3mb8,Hollandmarch76,1685682436.0,1,1.0,https://www.reddit.com/r/RandomThoughts/comments/13y3mb8/i_suspect_that_puddle_of_mudd_just_to_be_dicks/,,Randomthoughts
Women must have pissed outside just like men for thousands of years until it went out of fashion,21,,13y3hk8,reddituseryum,1685682008.0,6,0.88,https://www.reddit.com/r/RandomThoughts/comments/13y3hk8/women_must_have_pissed_outside_just_like_men_for/,,Randomthoughts
"Dwayne ""The Rock"" Johnson might actually be a good actor",4,"In Jumanji (both of them), he got to show a different side of his ""acting chops"" and I was able to believe he was a high schooler trapped in a muscular body. Almost crying, being scared and hesitant; it was hilarious! He's funnier and more believable when playing against stereotype or rather, playing *into* it.",13y3gd4,GibbousMoonCakes,1685681894.0,1,0.6,https://www.reddit.com/r/RandomThoughts/comments/13y3gd4/dwayne_the_rock_johnson_might_actually_be_a_good/,,Randomthoughts
Anything I type here might show up in a Google search any time after now.,2,"If someone has a similar thought and wants to Google it, they'll get this URL and read all your comments to my lame post.  
One day I'll forget about this post and a random person will comment and remind me about it.",13y38f9,Sun_At_Meridian,1685681103.0,1,1.0,https://www.reddit.com/r/RandomThoughts/comments/13y38f9/anything_i_type_here_might_show_up_in_a_google/,,Randomthoughts
I wonder if in the next fifty years life expectancy will be over 100,1,Every couple of decades life expectancy goes up. So I wonder how high,13y2uiv,nharvey5576,1685679786.0,2,1.0,https://www.reddit.com/r/RandomThoughts/comments/13y2uiv/i_wonder_if_in_the_next_fifty_years_life/,,Randomthoughts
For Profit colleges should NOT be allowed to have a website with a .edu domain.,1,K - 12 school districts cannot use .edu so why can for profit schools?,13y2j2l,AccomplishedLeader76,1685678723.0,3,0.81,https://www.reddit.com/r/RandomThoughts/comments/13y2j2l/for_profit_colleges_should_not_be_allowed_to_have/,,Randomthoughts
"If a mail deliverer orders something online, will they get to deliver it to themself or will someone else have to take it?",1,,13y2j29,AidanFDg,1685678722.0,3,1.0,https://www.reddit.com/r/RandomThoughts/comments/13y2j29/if_a_mail_deliverer_orders_something_online_will/,,Randomthoughts
I should've just done what I was told even if I didn't feel at peace with the idea and did what my friend told me to. After all I am just a dumb young person. What would I know and want,3,"My friend (f40) kept pushing me to move, I didn't feel at peace about the idea, she was just pushy and bitchy about this idea and every time I try to talk and explain how I feel about it so just talked over the top of me. Yea she brought up valid points about how I can always move back and to just try it for a few months but when you are extremely anxious person and it is easier said than done. Now apparently when I get to 30 I will be 'too old' and 'no one will want to be friends with you or date you'. Well shit I guess I am due to expire in two years 

Perhaps I should just kms since I have no purpose where I live and will be too old to move anyway so really what is the point in life",13y2hgn,losttwentysomething2,1685678593.0,1,1.0,https://www.reddit.com/r/RandomThoughts/comments/13y2hgn/i_shouldve_just_done_what_i_was_told_even_if_i/,,Randomthoughts
Very random thought...,3,"If I were to offend everybody to the point of violence on reddit, how would that affect me in real life. I am pretty sure all of you guys don't know where I live, so nobody would know who the perpetrator was/is.",13y1xjv,Chao123456,1685676780.0,1,1.0,https://www.reddit.com/r/RandomThoughts/comments/13y1xjv/very_random_thought/,,Randomthoughts
I think if more modern music was uplifting like in the thirties instead of depressing and nihilistic society wouldnt have less of a mass depressive phenomenon.,4,,13y1wd4,devildogmillman,1685676674.0,0,0.33,https://www.reddit.com/r/RandomThoughts/comments/13y1wd4/i_think_if_more_modern_music_was_uplifting_like/,,Randomthoughts
I wish I had a boyfriend named Great Mentally so I could finally tell people I'm doing great mentally and mean it.,3,,13y1nt6,unusualpanda1234,1685675917.0,7,1.0,https://www.reddit.com/r/RandomThoughts/comments/13y1nt6/i_wish_i_had_a_boyfriend_named_great_mentally_so/,,Randomthoughts
Anyone ever have a dream about getting shot? What happened in it?,2,"I keep thinking of the dream I had last night. I actually remember it in grave detail and I know time and dreams is weird but it was long so I’ll save you that part. But basically in the dream I was shot from a close range to a bullet to my head and then I fell. To finish me off they shot me a couple more times. I know you can’t die in dreams, but I didn’t wake up. It was like I was watching the rest of the dream unfold from my dead dream body. Anyone else ever have that experience?",13y1f1w,imyourlobster98,1685675166.0,1,1.0,https://www.reddit.com/r/RandomThoughts/comments/13y1f1w/anyone_ever_have_a_dream_about_getting_shot_what/,,Randomthoughts
I feel like any asshole could be a poet,3,,13y1ahz,Last_Descendant,1685674804.0,2,1.0,https://www.reddit.com/r/RandomThoughts/comments/13y1ahz/i_feel_like_any_asshole_could_be_a_poet/,,Randomthoughts
Adult sex workers could make a killing if they had something like Whore-Dash or Uber Beats. Get these workers some IT app support.,137,,13y15me,insanity2brilliance,1685674370.0,414,0.86,https://www.reddit.com/r/RandomThoughts/comments/13y15me/adult_sex_workers_could_make_a_killing_if_they/,,Randomthoughts
Only assertive people should own dogs,1,Like for fuck sakes. Codependent people are the worst at training pets,13y0w8q,Cultural_Two3620,1685673591.0,0,0.25,https://www.reddit.com/r/RandomThoughts/comments/13y0w8q/only_assertive_people_should_own_dogs/,,Randomthoughts
Rock music at 9:35 at night on a secluded street with a random cat hits different after a long day,2,,13y0v87,Individual_Iron4221,1685673504.0,2,1.0,https://www.reddit.com/r/RandomThoughts/comments/13y0v87/rock_music_at_935_at_night_on_a_secluded_street/,,Randomthoughts
"The temperature, without context doesn’t matter at all, it only matters when you compre it to other recent tempature",3,"I don’t know if that title makes sense, but I’ll explain here.

From the winter-summer transition this year, considering the extremely mild winter, I’ve started to wear shorts at 50 degrees F. Colder winters will push that down and down. I’ve worn shorts in 40 F.

Then in the summer-winter transition. 50 degrees F is cold. I don’t think I could ever possibly wear shorts in 50 degree F weather in autumn. In spring I absolutely would, but in autumn that notion is utterly ridiculous. I probably stop wearing shorts around 60 degrees F or so. 

Am I making sense here?",13y0ops,KittenTheSecond,1685672974.0,3,1.0,https://www.reddit.com/r/RandomThoughts/comments/13y0ops/the_temperature_without_context_doesnt_matter_at/,,Randomthoughts
"For having such a basic storyline and plot, studios really struggle to make a good live action Resident Evil film that is accurate and respectful to the source material.",1,"The story is so basic, it's literally a plot blueprint now thinking about it. Kind of ironic it's that unfilmable.",13y0kdt,Crafter235,1685672615.0,1,1.0,https://www.reddit.com/r/RandomThoughts/comments/13y0kdt/for_having_such_a_basic_storyline_and_plot/,,Randomthoughts
People who use baby talk can take a long walk off a short pier,11,"Seriously. Even when my kids were little we would talk to them like they were regular people. Never was it ""wittle baby blah blah blah"" type language.  I see parents do it and they automatically get knocked down a few rungs on the ladder of life",13y0jfv,VandelayImporter,1685672536.0,4,0.7,https://www.reddit.com/r/RandomThoughts/comments/13y0jfv/people_who_use_baby_talk_can_take_a_long_walk_off/,,Randomthoughts
Just realized I've got nobody but work people who will talk to me about a suicide that happened at my job.,1,"It's not everybody's cup of tea, or obligation  for that matter, and I get that. I've got no friends in this moment to work out being thrust into managing a situation I have no training on, seeing things, having to call about cleaning up the mess as if I was looking for a plumber, the existential thoughts that come with all of it. I gotta meet new people...",13y0j6v,madeaprofile2saythis,1685672515.0,2,1.0,https://www.reddit.com/r/RandomThoughts/comments/13y0j6v/just_realized_ive_got_nobody_but_work_people_who/,,Randomthoughts
people talk so much about caffeine in Coffee... guess most of the world ignores the existence of Guaraná (?) (both are delicious),1,,13y0hlu,eddythebamba,1685672386.0,1,1.0,https://www.reddit.com/r/RandomThoughts/comments/13y0hlu/people_talk_so_much_about_caffeine_in_coffee/,,Randomthoughts
"Stupid people can't just decide to be suddenly smart. We shouldn't get pissed at them for doing dumb stuff; they didn't choose their intelligence. Instead, we should be patient with them as fellow human beings.",10,,13y0e8b,johngrady77,1685672108.0,6,0.75,https://www.reddit.com/r/RandomThoughts/comments/13y0e8b/stupid_people_cant_just_decide_to_be_suddenly/,,Randomthoughts
"whenever i mean literally whenever i see something gore, or violent just hours or even minutes after that i imagine that the same thing is going to happen to my loved ones too. i imagine them they're the person in the gore video, my eyes widens up and i sometimes find myself crying and stressing so",3,,13y0bum,amazingsandyyay,1685671911.0,1,1.0,https://www.reddit.com/r/RandomThoughts/comments/13y0bum/whenever_i_mean_literally_whenever_i_see/,,Randomthoughts
Random Thoughts,1,"camouflage
/ˈkaməflɑː(d)ʒ/

Best way to hide things.",13y04jj,Ok-Orange7272,1685671319.0,1,1.0,https://www.reddit.com/r/RandomThoughts/comments/13y04jj/random_thoughts/,,Randomthoughts
Imagine if certain spiders could take on different houses like hermit crabs,1,Could it happen seeing as both species ha e 8 legs,13y00hs,thro_AWAYtuesday,1685670998.0,1,1.0,https://www.reddit.com/r/RandomThoughts/comments/13y00hs/imagine_if_certain_spiders_could_take_on/,,Randomthoughts
Minor inconveniences I hope my ex and his girlfriend has in the first few years of their new baby life,10,"I'm writing all this to get out the frustration ofmy ex having a baby after neglecting our son for yearsand him and his girl making my life a living hell. I suffered a miscarriage the same month their baby was born and it kinda felt like a slap in the face. Add to the list if you like 
1. The baby has thick cradle cap
2. Her breast milk dries up before she is done breast feeding 
3. Her baby has terrible baby acne
4. I hope evey time she takes the baby to the doctors he is fussy as hell
5. That they are always out of his size of diapers every time she needs some
6. I hope her baby is allergic to normal formula and she has to buy super expensive  formula 
6. I hope the baby has a booty blow out and shits over the side of the diapers 
7. I hope he pukes on all his clothes staining them  so she can just give them away when he out grows them
8. I hope poop stains all his clothes so bad they have to get thrown out
9. I hope he never settles easy at night
10. I hope he wakes up every hour on the hour",13y002f,ReflectionFast9270,1685670962.0,0,0.5,https://www.reddit.com/r/RandomThoughts/comments/13y002f/minor_inconveniences_i_hope_my_ex_and_his/,,Randomthoughts
do you ever feel like you are abnormally geeky about stuff?,2,,13xztsa,mikeybro1999,1685670443.0,1,1.0,https://www.reddit.com/r/RandomThoughts/comments/13xztsa/do_you_ever_feel_like_you_are_abnormally_geeky/,,Randomthoughts
"We stare at small screens all day, so we can stare at larger screens at night.",1,,13xzs9b,savingtheinternet,1685670321.0,1,1.0,https://www.reddit.com/r/RandomThoughts/comments/13xzs9b/we_stare_at_small_screens_all_day_so_we_can_stare/,,Randomthoughts
I don't want people wronging me just to apologize after. I just want them to treat me right.,1,,13xzp3v,Lifted2222,1685670063.0,3,1.0,https://www.reddit.com/r/RandomThoughts/comments/13xzp3v/i_dont_want_people_wronging_me_just_to_apologize/,,Randomthoughts
They're called ballerinas...,3,"Because if we had ballerinos, we'd therefore have to have balleriyeses.

I know it's not a smooth thought, just work with me on it...",13xzn1c,SLC-Grizzly,1685669895.0,1,1.0,https://www.reddit.com/r/RandomThoughts/comments/13xzn1c/theyre_called_ballerinas/,,Randomthoughts
"If we evolved to have eyes and ears on anywhere except our head (like eyes/ears on our hands or something), it would have taken a while for us to figure out that the organ inside our head is what helps us think.",1,,13xzln1,Relevant_Buy9593,1685669781.0,1,1.0,https://www.reddit.com/r/RandomThoughts/comments/13xzln1/if_we_evolved_to_have_eyes_and_ears_on_anywhere/,,Randomthoughts
Kill Bill Vol.1,1,kill bill background score sounds like ross’s sound (from friends) but its good.,13xzl6l,hey_u_sane,1685669743.0,1,1.0,https://www.reddit.com/r/RandomThoughts/comments/13xzl6l/kill_bill_vol1/,,Randomthoughts
Gordon Ramsey should play in a movie,1,A Liam Neeson type role,13xz6j1,Grouchy_Protection27,1685668575.0,1,1.0,https://www.reddit.com/r/RandomThoughts/comments/13xz6j1/gordon_ramsey_should_play_in_a_movie/,,Randomthoughts
"People always stereotype men to be the ones oblivious to flirting while women always know when someone's flirting with them or are frustrated with men not getting it. Then here I am, a woman, completely oblivious to flirting.",78,I can't count the number of times people flirted with me and I only found out later on through my friends that that was flirting. I genuinely thought most of them were just being friendly..,13xz4uj,in_a_cage_brb,1685668439.0,166,0.95,https://www.reddit.com/r/RandomThoughts/comments/13xz4uj/people_always_stereotype_men_to_be_the_ones/,,Randomthoughts
Do you still listen to that little voice inside you?,4,"I want to be cold and just don't give a care. I want to lay aside my passion and just give up. But there's a little voice inside me reminding this js not who I am. I am full of light, my life shines bright. I care and I do A LOT. I am passionate and I do the best I can because I love everything I do. There's no giving up because I am more than a conqueror. That little voice is minute yet powerful. I am hanging by a thread and it is that thread.",13xz1n5,palpable_fireball,1685668180.0,3,0.81,https://www.reddit.com/r/RandomThoughts/comments/13xz1n5/do_you_still_listen_to_that_little_voice_inside/,,Randomthoughts
It's funny that as we grow up our dream changed from want to be happy to just want to be dead,1,,13xyzw1,Extension_Buy9718,1685668036.0,3,0.81,https://www.reddit.com/r/RandomThoughts/comments/13xyzw1/its_funny_that_as_we_grow_up_our_dream_changed/,,Randomthoughts
What kind of superpower do you dream to have?,3,"If I get to choose a super power it would be to manipulate carbon. Whenever I’m out in public and someone bumps into me without looking I can literally force them into a wall where their whole body submerges into the dent caused by the impact, with just a thought. 

I really hate when you’re out in public and random people just bumps into you without looking or even saying “pardon me” 
I’m so serious about my personal space I would take any superpower which benefits my desires. Even if it means and end.

What would your ideal super power be and why?",13xyvmd,HoldMines_15,1685667707.0,3,1.0,https://www.reddit.com/r/RandomThoughts/comments/13xyvmd/what_kind_of_superpower_do_you_dream_to_have/,,Randomthoughts
Your car keys have traveled farther than your car.,1,,13xypev,Aggressive-Sound-641,1685667233.0,3,1.0,https://www.reddit.com/r/RandomThoughts/comments/13xypev/your_car_keys_have_traveled_farther_than_your_car/,,Randomthoughts
"Calling your boyfriend ""daddy"" during sex is 1000% less awkward than your boyfriend calling you ""mommy"".",27,,13xylfo,Sexyfish_007,1685666914.0,17,0.84,https://www.reddit.com/r/RandomThoughts/comments/13xylfo/calling_your_boyfriend_daddy_during_sex_is_1000/,,Randomthoughts
