title,num_comments,text,id,author,created_utc,score,upvote_ratio,url,flair,disorder
"""I feel bad for all of the women named Karen who are actually nice people."" - Richard.",142,,1286u6j,Large_Tune3029,1680312008.0,741,0.97,https://www.reddit.com/r/RandomThoughts/comments/1286u6j/i_feel_bad_for_all_of_the_women_named_karen_who/,,Randomthoughts
Do you ever just start to reply to someone with an argument or point against their logic and delete it thinking - I don't actually care enough about this?,133,,rdba5o,PrettyCauliflower638,1639150634.0,732,0.99,https://www.reddit.com/r/RandomThoughts/comments/rdba5o/do_you_ever_just_start_to_reply_to_someone_with/,,Randomthoughts
No matter how badly you mangle Bananafruit Cumberbun’s name people still know exactly who you’re talking about.,105,,w79w6q,JesseB342,1658707359.0,732,0.99,https://www.reddit.com/r/RandomThoughts/comments/w79w6q/no_matter_how_badly_you_mangle_bananafruit/,,Randomthoughts
"If the whole world stocked up and then quarantined for a month, would that end the pandemic?",436,Is this feasible?,rxndkf,PurelyCandid,1641498955.0,739,0.93,https://www.reddit.com/r/RandomThoughts/comments/rxndkf/if_the_whole_world_stocked_up_and_then/,,Randomthoughts
You have this paperclip,851,"And you’re told you have 5 mins to hide this paperclip in your house. A detective then has 24 hrs to come to your home and search for this paperclip. If at the end of the 24 hrs he can’t find the paper clip, you win $10,000.

Where do you hide it?",x3ei5m,thebentomouse,1662056048.0,731,0.94,https://www.reddit.com/r/RandomThoughts/comments/x3ei5m/you_have_this_paperclip/,,Randomthoughts
Why is it called a blowjob when a dick ends up getting sucked not blown,197,,q1kpd3,Professional-Device5,1633398541.0,728,0.94,https://www.reddit.com/r/RandomThoughts/comments/q1kpd3/why_is_it_called_a_blowjob_when_a_dick_ends_up/,,Randomthoughts
Fuck,158,"Fuck everything!  
Fuck being nice!

Fuck smiling at your boss!

Fuck nodding to his insane requests!

Fuck working till late!

Fuck smiling at your neighbor!

Fuck nodding at her boring anecdotes!

Fuck working after dinner!

Fuck sleep!   


Fuck your house!

Fuck everything!",poa62x,Siddh__,1631649026.0,726,0.91,https://www.reddit.com/r/RandomThoughts/comments/poa62x/fuck/,,Randomthoughts
"""Money does not buy happiness"" - I absolutely agree, BUT... It buys you financial security. It buys you peace of mind. It buys you freedom. It buys you the ability to help your loved ones financially... and for me, happiness can not exist without these things. How about you?",207,,11l41ab,sagittarinaofficial,1678206866.0,730,0.97,https://www.reddit.com/r/RandomThoughts/comments/11l41ab/money_does_not_buy_happiness_i_absolutely_agree/,,Randomthoughts
Gonorrhea would be a great name for a diarrhea medication,46,,xw22aq,Capital-Ice-6150,1664948812.0,723,0.99,https://www.reddit.com/r/RandomThoughts/comments/xw22aq/gonorrhea_would_be_a_great_name_for_a_diarrhea/,,Randomthoughts
What’s a good hobby to clear your mind?,1256,,vyklug,No_No_ahMY,1657765122.0,727,0.99,https://www.reddit.com/r/RandomThoughts/comments/vyklug/whats_a_good_hobby_to_clear_your_mind/,,Randomthoughts
"There could be so many people having sex right now, while you're reading this 😳",153,,x5tufc,Infamous-Magician505,1662315762.0,730,0.94,https://www.reddit.com/r/RandomThoughts/comments/x5tufc/there_could_be_so_many_people_having_sex_right/,,Randomthoughts
Prisons should be forced to give life insurance to inmates,561,"Edit 2: I understand how life insurance works. In this specific case the prison itself would pay be responsible for wrongful death in any case other than suicide or natural causes. Most US prisons for example are for-profit prisons which means they have as little security as possible in order to make sure their own guards are safe and still be profitable. 

Edit: For those saying I don't know anything about the prison system: The whole point of this post is that I disagree with the way most prisons are ran and think there should be radical change, especially in the US where most prisons are for-profit. There has to be a better way to do things. 

Edit 2: I understand how life insurance works. In this specific case the prison itself would pay be responsible for wrongful death in any case other than suicide or natural causes. Most US prisons for example are for-profit prisons which means they have as little security as possible in order to make sure their own guards are safe and at the same time still be profitable. 

&#x200B;",103z755,SearcherRC,1672926025.0,722,0.71,https://www.reddit.com/r/RandomThoughts/comments/103z755/prisons_should_be_forced_to_give_life_insurance/,,Randomthoughts
I (29m) can feel myself becoming a bitter old man and I'm trying to stop it but so many things about our society irritate me and I'm not sure how to stop,381,,xmgm1z,zzaawweq,1663986664.0,728,0.98,https://www.reddit.com/r/RandomThoughts/comments/xmgm1z/i_29m_can_feel_myself_becoming_a_bitter_old_man/,,Randomthoughts
I’m so tired of the billionaire worship,324,The amount of people who look up to people like Bezos and Musk is truly pathetic.. you’re closer to being the homeless person you pass by on your way to work than gaining even a fraction of the wealth either guy has,rll2ex,,1640111850.0,722,0.86,https://www.reddit.com/r/RandomThoughts/comments/rll2ex/im_so_tired_of_the_billionaire_worship/,,Randomthoughts
Gynecologist’s really just went out and got a degree in pussy.,54,"“What’re you a pussy professor?”

“yeah”",th67db,Omarneedshelp,1647622577.0,719,0.96,https://www.reddit.com/r/RandomThoughts/comments/th67db/gynecologists_really_just_went_out_and_got_a/,,Randomthoughts
I love upvoting people's posts to a nice round number,42,"I will always upvote posts that are at 49, 99, 199, 299 etc so the OP will get a notification. Feels good man.",s292ck,teenypanini,1642001653.0,723,0.93,https://www.reddit.com/r/RandomThoughts/comments/s292ck/i_love_upvoting_peoples_posts_to_a_nice_round/,,Randomthoughts
Why does always the fourth reply in a reddit comment chain get downvoted?,429,...or awarded.,w7p97m,iDespiseThisApp_,1658756410.0,724,0.88,https://www.reddit.com/r/RandomThoughts/comments/w7p97m/why_does_always_the_fourth_reply_in_a_reddit/,,Randomthoughts
"If girls masturbate with their finger, then small dicks shouldn’t be shamed for not being satisfying.",309,"Edit: sorry, this post was a bit unhinged. thanks for the sex-ed everyone.

Edit 2: OKAY I GET IT, DICKS ARE DIFFERENT FROM FINGERS

Edit 3: holy fuck i offended so many people, SORRY

Edit 4: I don’t watch porn i swear",vwqdxv,Disappoinlment,1657566736.0,727,0.79,https://www.reddit.com/r/RandomThoughts/comments/vwqdxv/if_girls_masturbate_with_their_finger_then_small/,,Randomthoughts
I really think I’ve discovered why we are here on earth right now.,244,"So I’ve spent literally the last 12ish years trying to figure out life. What I mean by that is what the nature of our reality really is. Like is this a simulation or something type stuff. I have come to the conclusion we are here for one purpose and that purpose is Love. To be loved, to receive it. I think when we die, how you treated others is super important but not damning.  I keep reading people’s NDE accounts and what the saw on the other side and I’ve seen a few where the actual amount of love they showed in life was quantified, like it’s an actual measurable thing after death. We are here to spread light in a dark world I think. We are here for one another. That’s it.",otvu7w,ThevoodooBandit,1627558920.0,721,0.88,https://www.reddit.com/r/RandomThoughts/comments/otvu7w/i_really_think_ive_discovered_why_we_are_here_on/,,Randomthoughts
What do you really want?,989,,rykxyf,agreatday248,1641597375.0,727,0.97,https://www.reddit.com/r/RandomThoughts/comments/rykxyf/what_do_you_really_want/,,Randomthoughts
We need wristbands that you wear when you're out drinking that knows when you are at .08 blood alcohol and beeps. This would make another good app for a smartphone too,258,,1298ext,crazyhappy2169,1680405656.0,716,0.92,https://www.reddit.com/r/RandomThoughts/comments/1298ext/we_need_wristbands_that_you_wear_when_youre_out/,,Randomthoughts
How do mermaids have children? HOW DO THEY EVEN DO THE DEED? And how do they give birth?,526,,vy6ykr,Notyourmery,1657728592.0,721,0.92,https://www.reddit.com/r/RandomThoughts/comments/vy6ykr/how_do_mermaids_have_children_how_do_they_even_do/,,Randomthoughts
what subreddits are you currently banned on and why?,833,,11b5c6s,cinnamonrollsandmilk,1677280909.0,718,0.91,https://www.reddit.com/r/RandomThoughts/comments/11b5c6s/what_subreddits_are_you_currently_banned_on_and/,,Randomthoughts
Why it’s socially acceptable to buy a gun which was made to kill people and it’s not ok to buy sex toy ?,409,,13f32lp,Jealous-Expression83,1683845980.0,716,0.81,https://www.reddit.com/r/RandomThoughts/comments/13f32lp/why_its_socially_acceptable_to_buy_a_gun_which/,,Randomthoughts
Do people actually care how other people dress in public?,976,"Sometimes I see people complain of how back in the day, people would actually put in the effort to dress somewhat nicely when going out for something casual, and now people are wearing sweatpants and PJs in grocery stores. And I'm like, why do you care? If I'm going grocery shopping or something menial, I'm gonna wear a t-shirt and sweatpants unapologetically. Find something actually worthwhile to get upset about. 

Edit: A lot of y'all are just inserting different examples that I didn't include, for a reason, just to think you proved a point. You didn't. 

Edit 2: If someone is dressed more casually in front of you, have you ever thought just maybe you're not worth their energy to impress you? Get over yourselves. ",11x8pu4,YesDaddysBoy,1679379574.0,719,0.91,https://www.reddit.com/r/RandomThoughts/comments/11x8pu4/do_people_actually_care_how_other_people_dress_in/,,Randomthoughts
"If you truly believe the earth is flat, please seek professional help.",307,,rn3ymx,StryfeSixx,1640289639.0,712,0.93,https://www.reddit.com/r/RandomThoughts/comments/rn3ymx/if_you_truly_believe_the_earth_is_flat_please/,,Randomthoughts
19 is such a shitty age . Fuck being 19 .,541,"I am turning 20 in July first and Let me tell u 
19 is the worst age ever , I feel like I know everything and know nothing at the same time .
I can do so many things and nothing at the same time . 
Motivated and tired , Disciplined but wants to lay down on bed all day . 
Wanting to play video games but when I play them I feel ashamed and my mind starts telling me to go do something productive for my future .
Afraid but strong, depressed but happy.
I just dont know what the fuck Am I doing or what M I supposed to do .
Life looks like a race to me rn and everyone seems ahead and have it figured out except me lol.
I can summarize Being an Adult in 3 words ""WHAT THE FUCK""

Edit : I did not expect this post to get this much attention , yall really wholesome , Reddit have one of the most cool people out there and some of the worst ones for sure lmao but Im lucky I have found more from the wholesome side . 
I just wrote this to kind of share one of my thoughts and I did not expect people to relate this much , yall made my day thank you so much <3 for all your advices and sharing your life experience with us who are just entering our 20s I know alot of people like me are readingthe comments and just having a goodtime ,  <3",13jzzea,xDayLoR,1684325580.0,712,0.85,https://www.reddit.com/r/RandomThoughts/comments/13jzzea/19_is_such_a_shitty_age_fuck_being_19/,,Randomthoughts
I like boobies.,180,,voe5pz,,1656610798.0,707,0.94,https://www.reddit.com/r/RandomThoughts/comments/voe5pz/i_like_boobies/,,Randomthoughts
Does anyone else worry that their ceiling fan might randomly fall off the ceiling?,234,,uohfs8,JIMMYY74,1652408478.0,710,0.99,https://www.reddit.com/r/RandomThoughts/comments/uohfs8/does_anyone_else_worry_that_their_ceiling_fan/,,Randomthoughts
"insta makes me insecure about my body, twitter makes me feel dumb,whatsapp realize me how lonely i m but reddit have peeps like me.",204,,13li71i,Ok-Dirt-8765,1684462556.0,713,0.86,https://www.reddit.com/r/RandomThoughts/comments/13li71i/insta_makes_me_insecure_about_my_body_twitter/,,Randomthoughts
Is everyone a little evil on the inside?,573,EDIT: Did not expect so many comments. It was very interesting to hear all the perspectives from you guys!,y8dife,,1666211587.0,705,0.95,https://www.reddit.com/r/RandomThoughts/comments/y8dife/is_everyone_a_little_evil_on_the_inside/,,Randomthoughts
If animals could speak . Which animal would be the most wholesome?,770,,s19tq0,,1641896566.0,706,0.98,https://www.reddit.com/r/RandomThoughts/comments/s19tq0/if_animals_could_speak_which_animal_would_be_the/,,Randomthoughts
"I'm so happy and grateful that beaches haven't been privatized yet. It is so nice to go for a swim and play with the waves without incurring any fee. Thank you so much for that, this is very generous",312,,12yjl85,chacaprr,1682429614.0,703,0.92,https://www.reddit.com/r/RandomThoughts/comments/12yjl85/im_so_happy_and_grateful_that_beaches_havent_been/,,Randomthoughts
"I hate trendy words like woke, shook and triggered.",672,,v8wly5,Repulsive_Holiday_96,1654825796.0,702,0.83,https://www.reddit.com/r/RandomThoughts/comments/v8wly5/i_hate_trendy_words_like_woke_shook_and_triggered/,,Randomthoughts
I'm tired of working hard to maintain friendships when the other people make little effort to care.,200,,12yeiwc,dystopian_manure,1682416245.0,704,0.97,https://www.reddit.com/r/RandomThoughts/comments/12yeiwc/im_tired_of_working_hard_to_maintain_friendships/,,Randomthoughts
Can we all agree that small spoons are better?,318,,zmrwsp,Jujuklig,1671128058.0,701,0.88,https://www.reddit.com/r/RandomThoughts/comments/zmrwsp/can_we_all_agree_that_small_spoons_are_better/,,Randomthoughts
What if porn websites ended with .cum rather than .com?,71,,ykhe7p,armindont15,1667423107.0,702,0.97,https://www.reddit.com/r/RandomThoughts/comments/ykhe7p/what_if_porn_websites_ended_with_cum_rather_than/,,Randomthoughts
Do people actually smoke after having sex or is it just in the movies?,262,,x7c022,,1662474456.0,698,0.99,https://www.reddit.com/r/RandomThoughts/comments/x7c022/do_people_actually_smoke_after_having_sex_or_is/,,Randomthoughts
"If the universe is still expanding, what is it expanding into?",380,,qotbvr,Fragrant_Ad2082,1636306206.0,704,0.98,https://www.reddit.com/r/RandomThoughts/comments/qotbvr/if_the_universe_is_still_expanding_what_is_it/,,Randomthoughts
My heart goes out to anyone insecure about their bodies. Don’t let society get you down.,111,,xxk2ur,Last_Descendant,1665100394.0,704,0.96,https://www.reddit.com/r/RandomThoughts/comments/xxk2ur/my_heart_goes_out_to_anyone_insecure_about_their/,,Randomthoughts
My children won’t know what life was like before the rainbow represented gay pride.,318,"edit: for anybody who is saying “so what”, this is r/randomthoughts. I just randomly had that thought and thought that I should put that thought somewhere.",oa07eo,DHB_Master,1624937863.0,704,0.88,https://www.reddit.com/r/RandomThoughts/comments/oa07eo/my_children_wont_know_what_life_was_like_before/,,Randomthoughts
Holidays don't feel that special anymore.,266,,zk5nar,Drakken11577,1670866686.0,704,0.96,https://www.reddit.com/r/RandomThoughts/comments/zk5nar/holidays_dont_feel_that_special_anymore/,,Randomthoughts
"Before you start your post with ""Am I the only one..."", stop... because no, you are not the only one.",210,,116abkk,MickJof,1676813381.0,696,0.95,https://www.reddit.com/r/RandomThoughts/comments/116abkk/before_you_start_your_post_with_am_i_the_only_one/,,Randomthoughts
"I’m turning 21 soon, I’m curious what drinks people enjoy or frequently order.",1773,Any help would be greatly appreciated!! <3,z3cz49,nubdaddy23,1669272992.0,695,0.91,https://www.reddit.com/r/RandomThoughts/comments/z3cz49/im_turning_21_soon_im_curious_what_drinks_people/,,Randomthoughts
What's the most interesting thing your inner monologue has said to you?,780,,13ebw2j,No_Boysenberry3497,1683775879.0,691,0.94,https://www.reddit.com/r/RandomThoughts/comments/13ebw2j/whats_the_most_interesting_thing_your_inner/,,Randomthoughts
"The lottery is now at $1.1 Billion. If you win it, what would you do with your winnings?",1608,,yjs94w,AffectionateSoft2495,1667354131.0,696,0.93,https://www.reddit.com/r/RandomThoughts/comments/yjs94w/the_lottery_is_now_at_11_billion_if_you_win_it/,,Randomthoughts
"Being homeless is mostly boring as fuck more than anything. If you want to make their day, give them a book.",98,"Obviously try to gauge what kind of person they are first and do not approach if you're afraid, but seriously guys....being homeless is fucking boring. I'm not homeless at the moment but a conversation earlier has triggered some random thoughts about when I was. 

Yes, it's cold. Yes, there are a lot of days you go hungry. Yes, it sucks. But it's mostly FUCKING BORING. Did you know that most people who are homeless and addicted to drugs only became addicted to drugs *after* they became homeless? Seriously, look it up. It's been studied. 

And you know why? Because homelessness is: 

A - fucking depressing and a pick me up doesn't sound like such a terrible idea after a while, especially if it's being given to you for free

B - FUCKING BORING and under-stimulating. And drugs are fun...for a short time until they are not.

A in combination with B is the perfect storm to create drug addiction. 

If you want to make a difference but you don't have much power, give them a book or something to draw on/with, or sit down and talk to them. That's it, man. That's all it could take to keep them off drugs and keep them from digging themselves further in to homelessness. It's not about your money. They're just like you. They get lonely. They get depressed and everyone shits on them. Just be nice. That's it. You don't have to spend a cent. An old book you don't want anymore? What's the problem with giving it to someone who would appreciate it rather than sending it to landfill?",p4lzfl,,1628997738.0,688,0.96,https://www.reddit.com/r/RandomThoughts/comments/p4lzfl/being_homeless_is_mostly_boring_as_fuck_more_than/,,Randomthoughts
I want to fall in love... but I am bored of everyone I meet.,385,,yxn0bb,sagittarinaofficial,1668681660.0,687,0.9,https://www.reddit.com/r/RandomThoughts/comments/yxn0bb/i_want_to_fall_in_love_but_i_am_bored_of_everyone/,,Randomthoughts
"What if there are more physical senses than the initial 5, but we lack the proper organ to sense them?",549,"I am going to prefice by saying this question is purely hypothetical, I'm not trying to debate anyone. The only reason I created this post was to maybe learn something, or at the least make people think ""Oh cool I never thought of that"". 

**Please stop commenting ""there's more than five senses"", that's not the point of this question. My question refers to whatever senses you count, whether it be the main five or the ones I've never heard of prior to making this post like proprioception or equilibrioception. I can't edit the title, thats not my fault. But I'm referring to a theoretical sense that we dont know about, that's why it's hypothetical. Thank you!**

—

We have bodily functions that help you perceive the world. Yes, I now know there are more than 5 main ones apparently but the most commonly referenced ones are touch, smell, taste, sight and hearing, thats what I grew up learning so I apologize for the title, I can't edit it.

People have body parts used to experience those senses. All I'm trying to say is hypothetically, what if there were more senses that we don't know about that the world offers, that we can never experience due to not having the proper body part for it (like needing a nose to smell or eyes to see).

—

This post is a prime example of common toxic Redditors who overthink a question that was never meant to be taken realistically in the first place, hence it being hypothetical. I appreciate those of you who understood, and I'm disappointed in those who pointlessly argued with me over this. Thanks!

Also I appreciate the awards, those of you who gave me them!",ue2wum,,1651173693.0,686,0.9,https://www.reddit.com/r/RandomThoughts/comments/ue2wum/what_if_there_are_more_physical_senses_than_the/,,Randomthoughts
What’s the most banal/boring thing you do that brings you joy?,746,,rihelh,TrippingGrady,1639747577.0,688,0.99,https://www.reddit.com/r/RandomThoughts/comments/rihelh/whats_the_most_banalboring_thing_you_do_that/,,Randomthoughts
If you think being gay is a choice than why do you think your children are atomatically straight?,508,Being straight would also be seen as a choice with that logic. Bisexuals can can still have kids. It makes no sense to believe in one of the other. You can't MAKE your penis get erected to certain things.,rhuh7f,,1639672625.0,687,0.83,https://www.reddit.com/r/RandomThoughts/comments/rhuh7f/if_you_think_being_gay_is_a_choice_than_why_do/,,Randomthoughts
Stay away from people who think they know better just because they’re older.,92,,ozrnn6,khayrirrw,1628336102.0,684,0.97,https://www.reddit.com/r/RandomThoughts/comments/ozrnn6/stay_away_from_people_who_think_they_know_better/,,Randomthoughts
"You think when people ask questions on reddit instead of googling, maybe it’s less that they want the answer, and more that they just want someone to interact with?",116,,yg2t1n,,1666996898.0,689,0.98,https://www.reddit.com/r/RandomThoughts/comments/yg2t1n/you_think_when_people_ask_questions_on_reddit/,,Randomthoughts
Why do people brush their teeth before breakfast instead of after?,448,it seems like it would work better after,y4zo22,Ghost_of_A_Canary,1665870664.0,684,0.97,https://www.reddit.com/r/RandomThoughts/comments/y4zo22/why_do_people_brush_their_teeth_before_breakfast/,,Randomthoughts
Gender reveal parties are WEIRD,249,"Seriously. What happened to saying ""it's a boy"" or ""it's a girl?"" Or you know, popping a balloon or a simple fucking cake. People throw ACTUAL parties to celebrate the fact that their child has male or female parts.",q46a3s,thenihilist0204,1633725448.0,684,0.92,https://www.reddit.com/r/RandomThoughts/comments/q46a3s/gender_reveal_parties_are_weird/,,Randomthoughts
Half of reddit is just people asking questions they could Google,244,,zqwli3,cypresswill44,1671562974.0,684,0.95,https://www.reddit.com/r/RandomThoughts/comments/zqwli3/half_of_reddit_is_just_people_asking_questions/,,Randomthoughts
Its fucked what Velma is doing to my beloved Scooby Doo.,400,,126ogd6,Shaelynnray30,1680185797.0,676,0.8,https://www.reddit.com/r/RandomThoughts/comments/126ogd6/its_fucked_what_velma_is_doing_to_my_beloved/,,Randomthoughts
Having to take another dump right after you just finished wiping has got to be the worst feeling ever,182,,13o28ju,ButterscotchNo8065,1684693284.0,679,0.95,https://www.reddit.com/r/RandomThoughts/comments/13o28ju/having_to_take_another_dump_right_after_you_just/,,Randomthoughts
"It sucks that February salary is lower because it's a shorter month but rent, subscriptions and any other monthly financial commitment is not lower for the same month",75,,11q7clq,lynk765,1678707675.0,674,0.96,https://www.reddit.com/r/RandomThoughts/comments/11q7clq/it_sucks_that_february_salary_is_lower_because/,,Randomthoughts
Your diagnosis doesn’t justify being horrible,325,"Having depression, autism, a personality disorder, etc, doesn’t give you the right to be a bully, abusive, or just a POS. while some of these disorders can EXPLAIN behavior, it’s certainly not an excuse. What do y’all think?",10o4n17,_-_-_Raelien_-_-_,1674987802.0,676,0.94,https://www.reddit.com/r/RandomThoughts/comments/10o4n17/your_diagnosis_doesnt_justify_being_horrible/,,Randomthoughts
Is it me or does it seem like most people are only your friend when it is convenient?,227,"Once you or they move away, they will easily forget about you and act  like you don't exist. Also, as soon as life gets busy they will stop  putting in the effort to talk to you. There never is going to be a  perfect time to stay in touch with someone because that is not how life  works. Sometimes, you have to make time. When you get on your deathbed,  you won't be thinking about all those hours you put in at work. You will  be thinking about the relationships you had or could have had.",11f1a4q,ari_peyton,1677669771.0,676,0.94,https://www.reddit.com/r/RandomThoughts/comments/11f1a4q/is_it_me_or_does_it_seem_like_most_people_are/,,Randomthoughts
Does it seem like people are more rude and mean than ever before,460,,znrlip,Calm-Pin-3151,1671231327.0,677,0.96,https://www.reddit.com/r/RandomThoughts/comments/znrlip/does_it_seem_like_people_are_more_rude_and_mean/,,Randomthoughts
Imagine having opposite allergies. QUICK HE CANT BREATHE GET THE PEANUTS,76,,13axs72,Waterlime204,1683482372.0,670,0.97,https://www.reddit.com/r/RandomThoughts/comments/13axs72/imagine_having_opposite_allergies_quick_he_cant/,,Randomthoughts
people with loving parents who are present in their lives are so lucky.,155,,ye9kiw,ilovefanfictionz,1666819871.0,673,0.99,https://www.reddit.com/r/RandomThoughts/comments/ye9kiw/people_with_loving_parents_who_are_present_in/,,Randomthoughts
"Humans consider themselves the pinnacle of evolution, but are the only species that has to wipe after pooping.",414,,12bzjyz,UsernameReee,1680648498.0,674,0.87,https://www.reddit.com/r/RandomThoughts/comments/12bzjyz/humans_consider_themselves_the_pinnacle_of/,,Randomthoughts
Men hate women who party but hate parties without women,504,,111x69w,Venom_Iam,1676361153.0,668,0.74,https://www.reddit.com/r/RandomThoughts/comments/111x69w/men_hate_women_who_party_but_hate_parties_without/,,Randomthoughts
