title,num_comments,text,id,author,created_utc,score,upvote_ratio,url,flair,disorder
What is so great about cum in porn ? For me it's a turn off.,8,"I really don't get it. For example blowjobs. The man ejaculate in the mouth of the women (ok) but then she shows the cum. Why? As prove to o show that it really happened? As a trophy for the man? Does the look of cum turn you on? What about the women? Do they really like it? I can't imagine that. I find it unnecessary, kind of a mood killer.  Because it goes from something intimate away to the public,  saying here you can see i came with this amount of cum, i am so proud. I find it pathetic. What are your thoughts?",13souwu,plantbaseduser,1685136073.0,1,0.67,https://www.reddit.com/r/RandomThoughts/comments/13souwu/what_is_so_great_about_cum_in_porn_for_me_its_a/,,Randomthoughts
"Its when a mosquito lands on your testicles, that's when your realize that violence isn't always the answer. it makes you think. Wow",2,,13sopww,Mr-Axo,1685135726.0,3,1.0,https://www.reddit.com/r/RandomThoughts/comments/13sopww/its_when_a_mosquito_lands_on_your_testicles_thats/,,Randomthoughts
Why should we travel to Mars? And when do you think we'll get there?,1,,13soomg,Ohmygodjesuschrist,1685135640.0,1,1.0,https://www.reddit.com/r/RandomThoughts/comments/13soomg/why_should_we_travel_to_mars_and_when_do_you/,,Randomthoughts
I'm drunk and I want to fuck,10,,13son76,Deechon,1685135534.0,0,0.5,https://www.reddit.com/r/RandomThoughts/comments/13son76/im_drunk_and_i_want_to_fuck/,,Randomthoughts
cherry poptarts > strawberry poptarts,4,,13soky9,Maknificence,1685135376.0,3,1.0,https://www.reddit.com/r/RandomThoughts/comments/13soky9/cherry_poptarts_strawberry_poptarts/,,Randomthoughts
"How much would all the unnecessary plastic waste we produce in one day weigh and could someone physically lift it? If so , what volume would it occupy?",1,"On a recent trip to Budapest , the fast food chains don’t give you lids or straws , you just drink from the cup which makes total sense.

When you buy fruit or vegetables it didn’t come wrapped in plastic.

It weighs nothing but just ends up in landfill I assume , but it’s crazy to think that every drink that is ordered in one McDonald’s has a lid and a straw which is straight in the bin.

Could Eddie Hall do a strongman lift on all the plastic waste we produce in one day?",13sojhe,No_Accountant7026,1685135266.0,1,1.0,https://www.reddit.com/r/RandomThoughts/comments/13sojhe/how_much_would_all_the_unnecessary_plastic_waste/,,Randomthoughts
Most people seem to care to much about stuff and drive themselves into unhappiness,2,,13so3pi,ChefJohnJ,1685134155.0,1,0.54,https://www.reddit.com/r/RandomThoughts/comments/13so3pi/most_people_seem_to_care_to_much_about_stuff_and/,,Randomthoughts
"Since Stewie from Family Guy caused the Big Bang, he is pretty much the God of that universe",3,,13snza0,ItzSaul,1685133834.0,1,1.0,https://www.reddit.com/r/RandomThoughts/comments/13snza0/since_stewie_from_family_guy_caused_the_big_bang/,,Randomthoughts
Someone said the 🤮 emoji looks like someone is giving Shrek really toothy head and I can't unsee it now,4,,13snxt6,Apersonma,1685133727.0,0,0.5,https://www.reddit.com/r/RandomThoughts/comments/13snxt6/someone_said_the_emoji_looks_like_someone_is/,,Randomthoughts
If there are wet dreams what would a slightly damp dream be?,2,,13snutv,Acrobatic-Income3693,1685133517.0,2,1.0,https://www.reddit.com/r/RandomThoughts/comments/13snutv/if_there_are_wet_dreams_what_would_a_slightly/,,Randomthoughts
How do blind people know when they’ve woken up in the morning and not still dreaming?,9,This seems terrifying to me,13snont,Nukethe-whales,1685133087.0,5,0.86,https://www.reddit.com/r/RandomThoughts/comments/13snont/how_do_blind_people_know_when_theyve_woken_up_in/,,Randomthoughts
I want to be a googolplexionair so freaking bad..,3,And buy a new bike.,13snn2j,Warm_Imagination5960,1685132981.0,2,1.0,https://www.reddit.com/r/RandomThoughts/comments/13snn2j/i_want_to_be_a_googolplexionair_so_freaking_bad/,,Randomthoughts
"I dunno why but everytime I pack my bags for vacation, I have the sudden urge to bring everything I see.",5,Yes this includes carpets and bed mattresses,13snm6w,ThunderBoi-thing,1685132915.0,3,1.0,https://www.reddit.com/r/RandomThoughts/comments/13snm6w/i_dunno_why_but_everytime_i_pack_my_bags_for/,,Randomthoughts
As loud as Christian nationalists have been as of late..,2,I think damn near every one of them need to reread James 4: 11-12.,13snkn7,CharlesIngalls_Pubes,1685132800.0,2,0.75,https://www.reddit.com/r/RandomThoughts/comments/13snkn7/as_loud_as_christian_nationalists_have_been_as_of/,,Randomthoughts
Does anyone else wrap themselves in a weighted blanket to feel like they're being hugged/spooned or am I just exceptionally lonely?,2,,13sn7sg,Regular_Ad9015,1685131883.0,6,0.81,https://www.reddit.com/r/RandomThoughts/comments/13sn7sg/does_anyone_else_wrap_themselves_in_a_weighted/,,Randomthoughts
What if most conflict is the result of not understanding deadpan comedy?,2,"How many times I've made a deadpan comment and people basically took out their katanas ready to draw my blood.

I once heard about a war Sweden waged with a neighbor because of some insult at a dinner party.

Do we need better humor?",13sn1nr,Engelgrafik,1685131449.0,2,1.0,https://www.reddit.com/r/RandomThoughts/comments/13sn1nr/what_if_most_conflict_is_the_result_of_not/,,Randomthoughts
I wonder if the reason solitary confinement is seen as torture is; we aren't prepared to be alone with ourselves.,3,"I don't doubt it, yet why are we so unprepared for this? We have had our entire lives to get to know ourselves.",13smsp3,OBS96,1685130827.0,2,1.0,https://www.reddit.com/r/RandomThoughts/comments/13smsp3/i_wonder_if_the_reason_solitary_confinement_is/,,Randomthoughts
Wtf,3,i'm this close to finding a sugar daddy 🤏,13smocy,mssc07,1685130519.0,0,0.5,https://www.reddit.com/r/RandomThoughts/comments/13smocy/wtf/,,Randomthoughts
Heard of Tony Hawk?,4,"Tony Hawk shows grace and wisdom like they have structure and meaning.

 I met him in 2018 by waiting outside of a bathroom stall he was shitting in, and the second he walked out of the stall I immediately shook his hand and and asked him his diet because while I was waiting I recognized the rare moment, I kinda felt like he was trying to subtly communicate some high-level  knowledge. 

 So I took a peek in the toilet bowl while he was washing his hands. What I saw was beautiful, they were these giant football-sized logs sitting compactly in the toilet bowl. 

I’m still trying to unpack the symbolism behind it.
 Any other takes? ?",13smmmy,Melodic-Pudding-8744,1685130395.0,2,0.75,https://www.reddit.com/r/RandomThoughts/comments/13smmmy/heard_of_tony_hawk/,,Randomthoughts
You know how painful it is when you get your finger stuck in the fast food drinks cup flid,2,,13smg8y,Numerous-Berry1376,1685129950.0,3,1.0,https://www.reddit.com/r/RandomThoughts/comments/13smg8y/you_know_how_painful_it_is_when_you_get_your/,,Randomthoughts
self harm is masturbation for masochists,2,,13sm4nv,trickytraveler,1685129131.0,1,0.67,https://www.reddit.com/r/RandomThoughts/comments/13sm4nv/self_harm_is_masturbation_for_masochists/,,Randomthoughts
Eggs are Underrated. One of best breakfast items to eat.,11,,13slr67,Sparkyplayz95,1685128204.0,18,0.82,https://www.reddit.com/r/RandomThoughts/comments/13slr67/eggs_are_underrated_one_of_best_breakfast_items/,,Randomthoughts
Stinky poops dropped by fat people probably stink up the bathroom less,10,If they're chub can make a halfway decent seal on the toilet seat they can do a courtesy flush and leave the room a lot less stanked than a thin person can,13sl2qi,hobosam21-B,1685126523.0,1,0.6,https://www.reddit.com/r/RandomThoughts/comments/13sl2qi/stinky_poops_dropped_by_fat_people_probably_stink/,,Randomthoughts
"I know why dogs bark seemingly without reason ... they are just saying ""I'm here"" prove me wrong!",2,,13sl0gw,JoanOfArk_Today,1685126363.0,1,1.0,https://www.reddit.com/r/RandomThoughts/comments/13sl0gw/i_know_why_dogs_bark_seemingly_without_reason/,,Randomthoughts
"cant keep acting nonchalant, i genuinely miss him.",1,,13skydb,probrachi,1685126208.0,2,1.0,https://www.reddit.com/r/RandomThoughts/comments/13skydb/cant_keep_acting_nonchalant_i_genuinely_miss_him/,,Randomthoughts
Has anyone ever seen a K-9 unit dog approach a regular dog ? Think the regular dog is thinking “oh shit here comes a cop” too ?,2,,13skui7,Moonwalker_4Life,1685125943.0,1,1.0,https://www.reddit.com/r/RandomThoughts/comments/13skui7/has_anyone_ever_seen_a_k9_unit_dog_approach_a/,,Randomthoughts
If the sink sponge is the grossest thing in the kitchen...,1,Then are my dishes actually clean or am I making them filthier by washing them.,13skpwh,biggoodvibe73,1685125622.0,3,1.0,https://www.reddit.com/r/RandomThoughts/comments/13skpwh/if_the_sink_sponge_is_the_grossest_thing_in_the/,,Randomthoughts
Do you guys randomly look at car windows to make sure there’s not a transformer on the road?,3,,13skphh,Past_Description4551,1685125591.0,3,1.0,https://www.reddit.com/r/RandomThoughts/comments/13skphh/do_you_guys_randomly_look_at_car_windows_to_make/,,Randomthoughts
Dating,1,"When we start dating, typically the last middle or early high school years (this may be different for others). However, I ponder if anyone else feels uncomfortable when they graduate from high school and are 18-20. Sometimes it feels awkward to date anyone older than 21 for me. I believe that feeling will go away once I am past 20. Though it just feels too soon to date anyone over 21. I hope this isn't just a me thing.",13skn9d,H0757uffn07r3411y,1685125432.0,3,1.0,https://www.reddit.com/r/RandomThoughts/comments/13skn9d/dating/,,Randomthoughts
WWE is just a soap opera geared towards men.,521,,13skmgb,stupidsimpson,1685125373.0,1946,0.95,https://www.reddit.com/r/RandomThoughts/comments/13skmgb/wwe_is_just_a_soap_opera_geared_towards_men/,,Randomthoughts
Does anyone else like to listen to music and read at the same time?,1,"For example, I find it hard to focus on what I'm reading if it's just silence, because I seem to pick up all kinds of little sounds like people talking or floors squeaking.  I like to listen to music because it kind of tunes that out. 

For example, right now I have Caroline, No on a loop. It can be kind of hard to pay attention to what I'm reading at the same time, but it's like the added challenge makes your brain try to focus harder. Just wondering if anyone else does this, or is it just me?",13skg52,LookingUp1734,1685124937.0,1,1.0,https://www.reddit.com/r/RandomThoughts/comments/13skg52/does_anyone_else_like_to_listen_to_music_and_read/,,Randomthoughts
I’ve kissed so many demodex,9,"I recently started dating this super cute guy, and we’ve been really lovey with each other. We haven’t kissed on the lips yet, but we give each other lots of kisses on the forehead, nose, cheeks, and neck. Now I keep thinking about how many demodex I’ve kissed to death while kissing my partner. What a lovely thought.",13skes4,HandsomeDevil3,1685124845.0,1,0.66,https://www.reddit.com/r/RandomThoughts/comments/13skes4/ive_kissed_so_many_demodex/,,Randomthoughts
"If i get eaten by a big fish in the ocean, will anyone ever know it?",13,,13skao4,VizzyTarg,1685124558.0,3,1.0,https://www.reddit.com/r/RandomThoughts/comments/13skao4/if_i_get_eaten_by_a_big_fish_in_the_ocean_will/,,Randomthoughts
No one is alone in nature and that’s comforting.,3,,13sk7yf,Jumpy_Inevitable_303,1685124374.0,3,1.0,https://www.reddit.com/r/RandomThoughts/comments/13sk7yf/no_one_is_alone_in_nature_and_thats_comforting/,,Randomthoughts
Too many parents think their kids owe them something for bringing them into a world they never asked to be brought into.,12,,13sk58k,MyYellowRose,1685124186.0,10,0.81,https://www.reddit.com/r/RandomThoughts/comments/13sk58k/too_many_parents_think_their_kids_owe_them/,,Randomthoughts
Tomatoes,1,why is it that the tomatoes in a vegetable tray are just the worst tomatoes youve ever had in your life.... every damn time?!,13sk0u7,HeyLady1106,1685123886.0,3,1.0,https://www.reddit.com/r/RandomThoughts/comments/13sk0u7/tomatoes/,,Randomthoughts
Time seems to move unrealisticly slow when microwaving a Hot Pocket.,2,,13sjzvf,ShockMonkey2001,1685123814.0,2,1.0,https://www.reddit.com/r/RandomThoughts/comments/13sjzvf/time_seems_to_move_unrealisticly_slow_when/,,Randomthoughts
There needs to be a slur for internet clout chasers,13,,13sj895,Remarkable_Bit_9887,1685121895.0,8,0.99,https://www.reddit.com/r/RandomThoughts/comments/13sj895/there_needs_to_be_a_slur_for_internet_clout/,,Randomthoughts
Confidence is just the cheat code to life,8,,13sj30z,ChefJohnJ,1685121531.0,9,0.71,https://www.reddit.com/r/RandomThoughts/comments/13sj30z/confidence_is_just_the_cheat_code_to_life/,,Randomthoughts
Typing Keyboards Are Instruments.,2,"If You're Familiar With FL STUDIO,  
OR Any Music DAW, You Understand.  
  
Today I was Reflecting,  
AND realized I've been playing  
an Instrument consistently my entire life;  
  
from violin, guitar, to piano  
  
AND Now A Typing KeyBoard;",13sj2xo,d-sane8,1685121524.0,2,1.0,https://www.reddit.com/r/RandomThoughts/comments/13sj2xo/typing_keyboards_are_instruments/,,Randomthoughts
"I love calling people who deserve it a ""sir"".",1,,13sitor,metalheadgamerdude,1685120890.0,2,1.0,https://www.reddit.com/r/RandomThoughts/comments/13sitor/i_love_calling_people_who_deserve_it_a_sir/,,Randomthoughts
"If we remove music from a song, does that become a poem?",8,,13sit4g,D0wnVoteMe_PLZ,1685120852.0,4,0.7,https://www.reddit.com/r/RandomThoughts/comments/13sit4g/if_we_remove_music_from_a_song_does_that_become_a/,,Randomthoughts
There are just too many irrelevant subs to mute now. Did I do something in my settings to start getting all these?,2,,13si8mh,MsAnnabel,1685119518.0,2,1.0,https://www.reddit.com/r/RandomThoughts/comments/13si8mh/there_are_just_too_many_irrelevant_subs_to_mute/,,Randomthoughts
Why is cinema so dark lately?,7,"Visually dark. Fucking dark. It's almost like all directors are obsessed with night scenes. Half of the time, my screen is just fucking dark. Is this a movie or what???",13si86a,pagalguy21,1685119492.0,5,0.99,https://www.reddit.com/r/RandomThoughts/comments/13si86a/why_is_cinema_so_dark_lately/,,Randomthoughts
HELP! How do I tell my bestie he's delusional?,7,My friend thinks he has the juiciest ass but anyone would agree that it's flat af. I've been trying to tell him since forever that he's being too delusional but he just refuses to believe it. His delusions are becoming especially concerning the last few months and I need help with how to deal with this. Please drop suggestions on what I could do to make it stop.,13si7kq,maddixx_x,1685119454.0,1,0.6,https://www.reddit.com/r/RandomThoughts/comments/13si7kq/help_how_do_i_tell_my_bestie_hes_delusional/,,Randomthoughts
Confession,5,I want to know if any straight guy will confess their one time same sex experience no matter how innocent it is,13si35d,Life_Charity7640,1685119175.0,3,1.0,https://www.reddit.com/r/RandomThoughts/comments/13si35d/confession/,,Randomthoughts
Reddit is awesome because you can be a nobody but still get hundreds if not thousands of upvotes and even more views.,5,"No other platform allows random people without a following to reach such a large audience. No where else could I post a meme, a shower thought or a poll and revive the amount of attention that they can on Reddit.",13shoyx,TrueReplayJay,1685118263.0,3,1.0,https://www.reddit.com/r/RandomThoughts/comments/13shoyx/reddit_is_awesome_because_you_can_be_a_nobody_but/,,Randomthoughts
Dr. Andy Mancini’s random thoughts,1,Isn’t funny that gyms is now full of selfies and videos but all the walking people are exercising in the malls,13shk56,AndyMancini,1685117954.0,1,1.0,https://www.reddit.com/r/RandomThoughts/comments/13shk56/dr_andy_mancinis_random_thoughts/,,Randomthoughts
"In 50 years wildlife numbers have decreased 70%, so in another 50 we probably won't have a functional ecosystem at all.",47,https://www.worldwildlife.org/press-releases/69-average-decline-in-wildlife-populations-since-1970-says-new-wwf-report,13sgoj3,hyteck9,1685115928.0,31,0.73,https://www.reddit.com/r/RandomThoughts/comments/13sgoj3/in_50_years_wildlife_numbers_have_decreased_70_so/,,Randomthoughts
"What would u do if a cow came up to u and said hello. and offered u 50 bucks. and as u take the money from the cow, an eagle approaches and snatches ur 50 bucks. then a police helicopter chases the eagle and the helicopter crash and a A10 goes after the eagle. and the cow sighs. ""that's unfortunate""",8,,13sgm8y,Mr-Axo,1685115771.0,0,0.5,https://www.reddit.com/r/RandomThoughts/comments/13sgm8y/what_would_u_do_if_a_cow_came_up_to_u_and_said/,,Randomthoughts
Ignorance is ungrateful? Humans and life,2,What object/creature/place/system/etc do humans rely on to thrive waaayy more than we even realize? The bigger significance to humanity with the least obviousness the better:,13sg9nf,grlprinceofthegalaxy,1685114966.0,0,0.5,https://www.reddit.com/r/RandomThoughts/comments/13sg9nf/ignorance_is_ungrateful_humans_and_life/,,Randomthoughts
A thick person is a well rounded individual.,2,,13sg4d5,Feisty-Initiative668,1685114613.0,2,1.0,https://www.reddit.com/r/RandomThoughts/comments/13sg4d5/a_thick_person_is_a_well_rounded_individual/,,Randomthoughts
Don’t wear red when shopping at Target,7,"No, I don’t know where the lightbulbs ar-…actually, they are probably near the home decor aisle. Sure, I could show you…",13sg40k,Responsible-Jury2579,1685114589.0,11,0.83,https://www.reddit.com/r/RandomThoughts/comments/13sg40k/dont_wear_red_when_shopping_at_target/,,Randomthoughts
It would be really ironic if the word ironic was left out of the dictionary.,4,,13sg3lj,DoomWad,1685114559.0,2,1.0,https://www.reddit.com/r/RandomThoughts/comments/13sg3lj/it_would_be_really_ironic_if_the_word_ironic_was/,,Randomthoughts
"As a fan of stand up, crowdwork is absolute cringe.",1,,13sg2bk,EcstaticOnion5278,1685114473.0,2,1.0,https://www.reddit.com/r/RandomThoughts/comments/13sg2bk/as_a_fan_of_stand_up_crowdwork_is_absolute_cringe/,,Randomthoughts
I don't get why eating dogs/cats is wrong.,19,"I really don't. Why do they get to live while animals like pigs and cows get slaughtered for food. It's like... So unfair-

I'm not saying we should not kill pigs and cows, but we eating cats and dogs shouldn't be so frowned upon, it's no different! 

Just because they're cute? Just because we're used to living with them? Just because they cuddle? Talk about bias treatment.",13sfyh7,zackphoenix123,1685114216.0,0,0.5,https://www.reddit.com/r/RandomThoughts/comments/13sfyh7/i_dont_get_why_eating_dogscats_is_wrong/,,Randomthoughts
Imagine if negative emotions didn't exist. Would there be any cons? Or only pros?,8,,13sfnnr,Ominous-Glitch,1685113513.0,2,0.67,https://www.reddit.com/r/RandomThoughts/comments/13sfnnr/imagine_if_negative_emotions_didnt_exist_would/,,Randomthoughts
When exactly did doctors start looking younger than me?,2,,13sfeix,Matrix2253,1685112925.0,1,1.0,https://www.reddit.com/r/RandomThoughts/comments/13sfeix/when_exactly_did_doctors_start_looking_younger/,,Randomthoughts
"Toxic people of Reddit should have a show where they all get off of this app, trip on some acid in the middle of a forest to finally find some peace within themselves.",6,,13sf2d3,s1c23,1685112125.0,3,0.67,https://www.reddit.com/r/RandomThoughts/comments/13sf2d3/toxic_people_of_reddit_should_have_a_show_where/,,Randomthoughts
Chocolate milk is always cold when you drink it but you never drink it with ice,13,,13sezoi,Iamvillager,1685111954.0,5,0.65,https://www.reddit.com/r/RandomThoughts/comments/13sezoi/chocolate_milk_is_always_cold_when_you_drink_it/,,Randomthoughts
A name that seems like it could be a good name for a girl: Nuance.,1,,13semt9,ravia,1685111073.0,0,0.5,https://www.reddit.com/r/RandomThoughts/comments/13semt9/a_name_that_seems_like_it_could_be_a_good_name/,,Randomthoughts
Holding the door open for people,39,"Honestly I hate the awkwardness of holding the door open for people. Like if they're too far away but still close enough it feels awkward to wait for them to get closer but there's also the worry that they will think youre rude for not holding it open. 

If me and another person are heading in the same general direction to a door I either find an alternative route or I speed up a bunch to where I make the distance between is greater to avoid the awkwardness of feeling obligated to hold the door open for them.",13see2u,agingerich97,1685110461.0,26,0.91,https://www.reddit.com/r/RandomThoughts/comments/13see2u/holding_the_door_open_for_people/,,Randomthoughts
"you ever thought that animals are just the oppisite of water filters,we drink clean(ish) water then put waste in it then it comes out of us again",1,,13secxs,CULT-LEWD,1685110380.0,1,1.0,https://www.reddit.com/r/RandomThoughts/comments/13secxs/you_ever_thought_that_animals_are_just_the/,,Randomthoughts
"""My bosses cannot organize a picnic together even if they tried""",1,"I think a picnic for 50 people is a tough task for many people. Too far from a happy execution for my bosses.

A picnic just for the two of them, I think they would just go to jimmy johns first and do the picnic with the sandwiches. They may forget the drinks if the employ doesn't ask..",13se6ui,meloa_verde,1685109953.0,1,1.0,https://www.reddit.com/r/RandomThoughts/comments/13se6ui/my_bosses_cannot_organize_a_picnic_together_even/,,Randomthoughts
Everytime I go get my teeth cleaned I think I should just go without brushing my teeth that day.,3,"Everytime I go get my teeth cleaned I think I should just go without brushing my teeth that day.   
Especially when my appointment is 1st thing in the morning. I mean they can scrap last nights gunk off while they are at it",13se589,sneezhousing,1685109839.0,0,0.5,https://www.reddit.com/r/RandomThoughts/comments/13se589/everytime_i_go_get_my_teeth_cleaned_i_think_i/,,Randomthoughts
So I'm going to a cabin this summer and this annoyed me,2,"I was looking at the cabin I'm staying at sometime this summer, and I was gonna suggest to my grandma that she should bring her dogs. Because they have a dog park and they could run around. So I was reading their pet policy there to see if there's any fees or anything, and there's not it was just the average stuff you needed to do for your dogs like they have to have all their shots, clean up their waste, keep them under control, don't leve them unattended outside. And then they get to certain breeds you can't bring, and the first breed there is are the same breed my grandma's dogs are.... Pitbulls. That just makes me mad. Pitbulls are not dangerous. My grandma's younger dog is wild and will jump up on you. But the other one is the sweetest dog ever. He's older than me in human years and only wants to sleep. Why do they always get excluded? The other dogs on there are Doberman pinchers,Rottweilers, and Chow-Chows. Two of those dogs are big, wouldn't it make more sense to bring big dogs to a campsite than a little dog?",13se0v1,VioletRegnier,1685109574.0,0,0.5,https://www.reddit.com/r/RandomThoughts/comments/13se0v1/so_im_going_to_a_cabin_this_summer_and_this/,,Randomthoughts
What's that one song that brings back a memory you cringe so hard to you can't listen to it?,2,,13sdzgw,purple_kitty43,1685109478.0,1,1.0,https://www.reddit.com/r/RandomThoughts/comments/13sdzgw/whats_that_one_song_that_brings_back_a_memory_you/,,Randomthoughts
Why do dads always seem to help with math homework?,25,"It's a cliche in film, tv, and real life that dad helps the teenager with their math homework after he gets home. Why is that? What about being a dad makes you more qualified to help with math homework?",13sdv62,LilCorbs,1685109186.0,7,0.67,https://www.reddit.com/r/RandomThoughts/comments/13sdv62/why_do_dads_always_seem_to_help_with_math_homework/,,Randomthoughts
"Men. Dont bother posting on ""guessmyage"". Everyone questions why a man is posting there. They think i am trying to pick up chick, which works, but the point is that some male posting in an account of mostly women is looked with speculation.",1,,13sdrz7,velascono,1685108965.0,2,1.0,https://www.reddit.com/r/RandomThoughts/comments/13sdrz7/men_dont_bother_posting_on_guessmyage_everyone/,,Randomthoughts
"If think that you are not clueless, it could an indicator that are clueless.",1,,13sdnnm,megacerealcrunch,1685108657.0,1,1.0,https://www.reddit.com/r/RandomThoughts/comments/13sdnnm/if_think_that_you_are_not_clueless_it_could_an/,,Randomthoughts
